# Data from Clarivate Analytics' Web of Science, retrieved 29 October 2018
# This file generated on 2018-11-23 17:10:07
item,AU,DE,DOI,SO,id,title,year,DOI link
0,"Dao Nguyen Khoi, |Vu Thi Thom, |Chau Nguyen Xuan Quang, |Ho Long Phi, ",dong nai river basin|glue|parasol|pso|sufi-2|swat model|uncertainty analysis,10.1051/lhb/2017003,HOUILLE BLANCHE-REVUE INTERNATIONALE DE L EAU,WOS:000396894600003,Parameter uncertainty analysis for simulating streamflow in the upper Dong Nai river basin,2017,https://dx.doi.org/10.1051/lhb/2017003
808,"Rospriandana, Naufal|Fujii, Masahiko",renewable energy|small hydropower|swat|hydrological modeling|gis|indonesia,10.3178/hrl.11.6,HYDROLOGICAL RESEARCH LETTERS,WOS:000416311100002,"Assessment of small hydropower potential in the Ciwidey subwatershed, Indonesia: a GIS and hydrological modeling approach",2017,https://dx.doi.org/10.3178/hrl.11.6
810,"Dugan, Alexa J.|Birdsey, Richard|Healey, Sean P.|Pan, Yude|Zhang, Fangmin|Mo, Gang|Chen, Jing|Woodall, Christopher W.|Hernandez, Alexander J.|McCullough, Kevin|McCarter, James B.|Raymond, Crystal L.|Dante-Wood, Karen",forest carbon|forest inventory|ecosystem model|climate change|national forests,10.1007/s10584-017-2038-5,CLIMATIC CHANGE,WOS:000409001300010,Forest sector carbon analyses support land management planning and projects: assessing the influence of anthropogenic and natural factors,2017,https://dx.doi.org/10.1007/s10584-017-2038-5
814,"Rosemary, F.|Vitharana, U. W. A.|Indraratne, S. P.|Weerasooriya, R.|Mishra, U.",spatial heterogeneity|geo-statistical analysis|land uses|soil catena,10.1016/j.catena.2016.10.017,CATENA,WOS:000392686000007,Exploring the spatial variability of soil properties in an Alfisol soil catena,2017,https://dx.doi.org/10.1016/j.catena.2016.10.017
818,"Meaurio, Maite|Zabaleta, Ane|Boithias, Laurie|Miren Epelde, Ane|Sauvage, Sabine|Sanchez-Perez, Jose-Miguel|Srinivasan, Raghavan|Antiguedad, Inaki",cmip5|hydrological trend|high flow and low flow|swat model|atlantic region|transition zone,10.1016/j.jhydrol.2017.02.029,JOURNAL OF HYDROLOGY,WOS:000403739000005,Assessing the hydrological response from an ensemble of CMIP5 climate projections in the transition zone of the Atlantic region (Bay of Biscay),2017,https://dx.doi.org/10.1016/j.jhydrol.2017.02.029
819,"Ren, Yufeng|Cai, Shixiang|Liu, Xing|Ao, Tianqi",precipitation|trmm|3b42v7|btopmc|data-sparse basins|hydrological modelling,,JOURNAL OF ENVIRONMENTAL PROTECTION AND ECOLOGY,WOS:000407305300005,DAILY STREAMFLOW PROCESS SIMULATION IN THE DATA-SPARSE BASINS,2017,https://dx.doi.org/
823,"van Lier, Quirijn de Jong",crop water availability|drainage|hydrological modeling|bucket model,10.1016/j.agwat.2017.08.017,AGRICULTURAL WATER MANAGEMENT,WOS:000412255400018,"Field capacity, a valid upper limit of crop available water?",2017,https://dx.doi.org/10.1016/j.agwat.2017.08.017
825,"Mahowald, Natalie M.|Ward, Daniel S.|Doney, Scott C.|Hess, Peter G.|Randerson, James T.",land use|climate change|agriculture|deforestation,10.1088/1748-9326/aa836d,ENVIRONMENTAL RESEARCH LETTERS,WOS:000411254800001,Are the impacts of land use on warming underestimated in climate policy?,2017,https://dx.doi.org/10.1088/1748-9326/aa836d
829,"Wei, Yaping|Fan, Jinglong|Xu, Xinwen|Lei, Jiaqiang",pumping test|aquifer test|pressure correction|hydrogeological parameters,10.24850/j-tyca-2017-02-14,TECNOLOGIA Y CIENCIAS DEL AGUA,WOS:000403101600014,"Water table response to a pumping test in the hinterland core area of the Taklimakan Desert, China",2017,https://dx.doi.org/10.24850/j-tyca-2017-02-14
830,"Zhang, Xiaodong|Vesselinov, Velimir V.",water-energy-food nexus|socioeconomic demands|environmental impacts|modeling|optimal management|ghg emission control,10.1016/j.advwatres.2016.12.017,ADVANCES IN WATER RESOURCES,WOS:000395853600001,"Integrated modeling approach for optimal management of water, energy and food security nexus",2017,https://dx.doi.org/10.1016/j.advwatres.2016.12.017
833,"Kato, Etsushi|Moriyama, Ryo|Kurosawa, Atsushi|Dixon, T|Laloui, L|Twinning, S",beccs|energy crops|integrated assessment model,10.1016/j.egypro.2017.03.1748,"13TH INTERNATIONAL CONFERENCE ON GREENHOUSE GAS CONTROL TECHNOLOGIES, GHGT-13",WOS:000419147306036,A sustainable pathway of bioenergy with carbon capture and storage deployment,2017,https://dx.doi.org/10.1016/j.egypro.2017.03.1748
837,"Estrada, Leonel Lara|Rasche, Livia|Schneider, Uwe A.",land evaluation|ecological modeling|suitability functions|bayesian networks|integrated modeling framework,10.1016/j.envsoft.2017.06.028,ENVIRONMENTAL MODELLING & SOFTWARE,WOS:000406177500016,Modeling land suitability for Coffea arabica L. in Central America,2017,https://dx.doi.org/10.1016/j.envsoft.2017.06.028
840,"Theodoridou, I.|Karteris, M.|Mallinis, G.|Tsiros, E.|Karteris, A.|Bikas, D|Theodosiou, T|Katerina, T",green roofs|urban environment|remote sensing|large-scale energy consumption|carbon sequestration,10.1016/j.proenv.2017.03.117,SUSTAINABLE SYNERGIES FROM BUILDINGS TO THE URBAN SCALE,WOS:000410925400068,"Assessing the Benefits from Retrofitting Green Roofs in Mediterranean, using Environmental Modelling, GIS and very high Spatial Resolution Remote Sensing Data: The example of Thessaloniki, Greece",2017,https://dx.doi.org/10.1016/j.proenv.2017.03.117
841,"Delavau, Carly J.|Stadnyk, Tricia|Holmes, Tegan",,10.5194/hess-21-2595-2017,HYDROLOGY AND EARTH SYSTEM SCIENCES,WOS:000402326300001,"Examining the impacts of precipitation isotope input (delta O-18(ppt)) on distributed, tracer-aided hydrological modelling",2017,https://dx.doi.org/10.5194/hess-21-2595-2017
844,"Rahman, Kazi|Ray, Nicolas|Giuliani, Gregory|Maringanti, Chetan|George, Chris|Lehmann, Anthony",swat model|open source software|free data|hydrology,10.1134/S0097807817010067,WATER RESOURCES,WOS:000396417800004,Breaking Walls Towards Fully Open Source Hydrological Modeling,2017,https://dx.doi.org/10.1134/S0097807817010067
848,"Arciniega-Esparza, Saul|Agustin Brena-Naranjo, Jose|Pedrozo-Acuna, Adrian|Mario Appendini, Christian",streamflow|recession|storage-discharge relationships|baseflow|toolbox,10.1016/j.cageo.2016.10.005,COMPUTERS & GEOSCIENCES,WOS:000389294300010,HYDRORECESSION: A Matlab toolbox for streamflow recession analysis,2017,https://dx.doi.org/10.1016/j.cageo.2016.10.005
856,"Saranjampour, Parichehr|Armbrust, Kevin L.|Marx, Brian D.",dibenzothiophenes|environmental modeling|fate and transport|hydroxyl radical|volatilization|polycyclic aromatic hydrocarbons,10.1002/etc.3745,ENVIRONMENTAL TOXICOLOGY AND CHEMISTRY,WOS:000406398400007,ASSESSING THE HYDROXYL RADICAL AND VOLATILIZATION ROLES IN AQUATIC FATE ESTIMATIONS OF SULFUR HETEROCYCLES: DIBENZOTHIOPHENE DERIVATIVES,2017,https://dx.doi.org/10.1002/etc.3745
857,"Khan, Hassaan Furqan|Yang, Y. C. Ethan|Xie, Hua|Ringler, Claudia",,10.5194/hess-21-6275-2017,HYDROLOGY AND EARTH SYSTEM SCIENCES,WOS:000417851600001,A coupled modeling framework for sustainable watershed management in transboundary river basins,2017,https://dx.doi.org/10.5194/hess-21-6275-2017
858,"Cordioli, M.|Pironi, C.|De Munari, E.|Marmiroli, N.|Lauriola, P.|Ranzi, A.",land use regression model|exposure assessment|spatiotemporal model|gis|air pollution,10.1016/j.scitotenv.2016.09.089,SCIENCE OF THE TOTAL ENVIRONMENT,WOS:000389090100100,Combining land use regression models and fixed site monitoring to reconstruct spatiotemporal variability of NO2 concentrations over a wide geographical area,2017,https://dx.doi.org/10.1016/j.scitotenv.2016.09.089
860,"Zhao, Xiaomin|Lung, Wu-Seng",hormones|17 beta-estradiol|fate and transport|hspf modeling|basins,10.1016/j.chemosphere.2017.08.058,CHEMOSPHERE,WOS:000411846900092,Modeling the fate and transport of 17 beta-estradiol in the South River watershed in Virginia,2017,https://dx.doi.org/10.1016/j.chemosphere.2017.08.058
861,"Dang, Thai Son|Wessels, Nicola|Ngoc-Son Nguyen, |Hackl, Klaus|Meschke, Guenther",tunnel boring machine|cutting wheel|discrete element method|parameter identification|non-newtonian flow|finite element method,10.1615/IntJMultCompEng.2017020271,INTERNATIONAL JOURNAL FOR MULTISCALE COMPUTATIONAL ENGINEERING,WOS:000407991300003,A COUPLED COMPUTATIONAL APPROACH FOR THE SIMULATION OF SOIL EXCAVATION AND TRANSPORT IN EARTH-PRESSURE BALANCE SHIELD MACHINES,2017,https://dx.doi.org/10.1615/IntJMultCompEng.2017020271
864,"Zhang, Ying|Hou, Jinhang|Cao, Yongpan|Gu, Juan|Huang, Chunlin",grid|parallel|swat|hydrological model|openmp,10.1016/j.cageo.2017.08.002,COMPUTERS & GEOSCIENCES,WOS:000415663200021,OpenMP parallelization of a gridded SWAT (SWATG),2017,https://dx.doi.org/10.1016/j.cageo.2017.08.002
865,"Toth, Brigitta|Weynants, Melanie|Pasztor, Laszlo|Hengl, Tomislav",3d european soil hydraulic maps|eu-soilhydrogrids|mualem-van genuchten parameters|multilayered gridded information|soil hydraulic conductivity|soil water retention,10.1002/hyp.11203,HYDROLOGICAL PROCESSES,WOS:000405521700013,3D soil hydraulic database of Europe at 250 m resolution,2017,https://dx.doi.org/10.1002/hyp.11203
866,"Nielsen, Anders|Bolding, Karsten|Hu, Fenjuan|Trolle, Dennis",aquatic ecosystem modelling|qgis plugin|fabm-pclake|gotm|swat,10.1016/j.envsoft.2017.06.032,ENVIRONMENTAL MODELLING & SOFTWARE,WOS:000406177500027,An open source QGIS-based workflow for model application and experimentation with aquatic ecosystems,2017,https://dx.doi.org/10.1016/j.envsoft.2017.06.032
868,"Ritschel, Christoph|Ulbrich, Uwe|Nevir, Peter|Rust, Henning W.",,10.5194/hess-21-6501-2017,HYDROLOGY AND EARTH SYSTEM SCIENCES,WOS:000418324300002,Precipitation extremes on multiple timescales - Bartlett-Lewis rectangular pulse model and intensity-duration-frequency curves,2017,https://dx.doi.org/10.5194/hess-21-6501-2017
871,"Swanson, Travis|Mohrig, David|Kocurek, Gary|Liang, Man",aeolian|dune|bedform|exploratory numerical model,10.1007/s11004-016-9654-x,MATHEMATICAL GEOSCIENCES,WOS:000403359900005,A Surface Model for Aeolian Dune Topography,2017,https://dx.doi.org/10.1007/s11004-016-9654-x
873,"Hong, Eun-Mi|Pachepsky, Yakov A.|Whelan, Gene|Nicholson, Thomas",complexity|environmental modeling|metamodeling|model simplification,10.1080/10643389.2017.1393264,CRITICAL REVIEWS IN ENVIRONMENTAL SCIENCE AND TECHNOLOGY,WOS:000419156600001,Simpler models in environmental studies and predictions,2017,https://dx.doi.org/10.1080/10643389.2017.1393264
874,"Stern, David I.",integrated assessment models|business as usual|projections,10.1007/s10584-017-2003-3,CLIMATIC CHANGE,WOS:000407170600019,How accurate are energy intensity projections?,2017,https://dx.doi.org/10.1007/s10584-017-2003-3
875,"Klise, Katherine A.|Bynum, Michael|Moriarty, Dylan|Murray, Regan",water distribution system|earthquake|resilience|software,10.1016/j.envsoft.2017.06.022,ENVIRONMENTAL MODELLING & SOFTWARE,WOS:000406177500031,A software framework for assessing the resilience of drinking water systems to disasters with an example earthquake case study,2017,https://dx.doi.org/10.1016/j.envsoft.2017.06.022
809,"Liu, Yanhua|Wang, Yaqi|Zhang, Jie|Sun, Liu|Zhang, Anqi|Torres, Oscar Lopez|Guo, Ruixin|Chen, Jianqiu",ceftazidime|photoproducts|feeding behavior|rotifer|exposure and post-exposure,10.1016/j.ecoenv.2017.06.039,ECOTOXICOLOGY AND ENVIRONMENTAL SAFETY,WOS:000408520100030,An integrated assessment of ceftazidime and photoproducts on the feeding behavior of rotifers: From exposure to post-exposure,2017,https://dx.doi.org/10.1016/j.ecoenv.2017.06.039
806,"Kurtz, Wolfgang|Lapin, Andrei|Schilling, Oliver S.|Tang, Qi|Schiller, Eryk|Braun, Torsten|Hunkeler, Daniel|Vereecken, Harry|Sudicky, Edward|Kropf, Peter|Franssen, Harrie-Jan Hendricks|Brunner, Philip",cloud computing|integrated hydrological modelling|data assimilation|water resources management|hydrogeosphere|wireless sensor networks,10.1016/j.envsoft.2017.03.011,ENVIRONMENTAL MODELLING & SOFTWARE,WOS:000403512500029,"Integrating hydrological modelling, data assimilation and cloud computing for real-time management of water resources",2017,https://dx.doi.org/10.1016/j.envsoft.2017.03.011
748,"Green, Emma L.|Eigenbrod, Felix|Schreckenberg, Kate|Willcock, Simon",africa|ecosystem service|forest|modelling|sustainable forest management|yield|zomba,10.1017/S0376892916000485,ENVIRONMENTAL CONSERVATION,WOS:000395481800008,Modelling tree growth to determine the sustainability of current off-take from miombo woodland: a case study from rural villages in Malawi,2017,https://dx.doi.org/10.1017/S0376892916000485
804,"Marcos-Garcia, P.|Lopez-Nicolas, A.|Pulido-Velazquez, M.",standardized drought indices|climate change impact|meteorological droughts|hydrological droughts|evapotranspiration,10.1016/j.jhydrol.2017.09.028,JOURNAL OF HYDROLOGY,WOS:000415769600021,Combined use of relative drought indices to analyze climate change impact on meteorological and hydrological droughts in a Mediterranean basin,2017,https://dx.doi.org/10.1016/j.jhydrol.2017.09.028
750,"Hong, Yi|Bonhomme, Celine|Van den Bout, Bastian|Jetten, Victor|Chebbo, Ghassan",integrated modelling|traffic-related pollutants|spatially-distributed modelling|openlisem|swmm|urban stormwater,10.1016/j.envsoft.2017.06.047,ENVIRONMENTAL MODELLING & SOFTWARE,WOS:000408356600014,"Integrating atmospheric deposition, soil erosion and sewer transport models to assess the transfer of traffic-related pollutants in urban areas",2017,https://dx.doi.org/10.1016/j.envsoft.2017.06.047
751,"Chapra, Steven C.|Boehlert, Brent|Fant, Charles|Bierman, Victor J.|Henderson, Jim|Mills, David|Mas, Diane M. L.|Rennels, Lisa|Jantarasami, Lesley|Martinich, Jeremy|Strzepek, Kenneth M.|Paerl, Hans W.",,10.1021/acs.est.7b01498,ENVIRONMENTAL SCIENCE & TECHNOLOGY,WOS:000407987400007,Climate Change Impacts on Harmful Algal Blooms in US Freshwaters: A Screening-Level Assessment,2017,https://dx.doi.org/10.1021/acs.est.7b01498
753,"Ofoegbu, G. I.|Dasgupta, B.|Manepally, C.|Stothoff, S. A.|Fedors, R.",expansive clay|bentonite|unsaturated|suction|bishop principle|swelling pressure,10.1007/s12665-017-6884-2,ENVIRONMENTAL EARTH SCIENCES,WOS:000408499100009,Modeling the mechanical behavior of unsaturated expansive soils based on Bishop principle of effective stress,2017,https://dx.doi.org/10.1007/s12665-017-6884-2
755,"Alcaraz, Mar|Vazquez-Sune, Enric|Velasco, Violeta|Criollo, Rotman",loose coupling approach|hydrogeological numerical model|mesh generation,10.1007/s12665-017-6709-3,ENVIRONMENTAL EARTH SCIENCES,WOS:000403434600002,A loosely coupled GIS and hydrogeological modeling framework,2017,https://dx.doi.org/10.1007/s12665-017-6709-3
757,"Fraser, Hannah|Rumpff, Libby|Yen, Jian D. L.|Robinson, Doug|Wintle, Brendan A.",bayesian network|multicriteria decision analysis|species distribution models|state-and-transition model|trade-offs,10.1111/cobi.12939,CONSERVATION BIOLOGY,WOS:000417183900020,Integrated models to support multiobjective ecological restoration decisions,2017,https://dx.doi.org/10.1111/cobi.12939
758,"Thorbek, Pernille|Campbell, Peter J.|Thompson, Helen M.",ecological risk assessment|environmental modeling|population modeling|population-level effects|ecological modeling|honeybee,10.1002/etc.3581,ENVIRONMENTAL TOXICOLOGY AND CHEMISTRY,WOS:000394698700024,COLONY IMPACT OF PESTICIDE-INDUCED SUBLETHAL EFFECTS ON HONEYBEE WORKERS: A SIMULATION STUDY USING BEEHAVE,2017,https://dx.doi.org/10.1002/etc.3581
759,"Benitez-Lopez, Ana|Vinuela, Javier|Mougeot, Francois|Garcia, Jesus T.",conservation|ecological modelling|habitat selection|human disturbance|pterocles alchata|pterocles orientalis,10.1007/s10531-016-1222-7,BIODIVERSITY AND CONSERVATION,WOS:000392186600004,A multi-scale approach for identifying conservation needs of two threatened sympatric steppe birds,2017,https://dx.doi.org/10.1007/s10531-016-1222-7
761,"Dean, Danielle O.|Bauer, Daniel J.|Prinstein, Mitchell J.",event history analysis|generalized linear modeling|multilevel modeling|social network analysis|survival analysis,10.1080/00273171.2016.1267605,MULTIVARIATE BEHAVIORAL RESEARCH,WOS:000403837200001,Friendship Dissolution Within Social Networks Modeled Through Multilevel Event History Analysis,2017,https://dx.doi.org/10.1080/00273171.2016.1267605
763,"Ruane, Alex C.|Rosenzweig, Cynthia|Asseng, Senthold|Boote, Kenneth J.|Elliott, Joshua|Ewert, Frank|Jones, James W.|Martre, Pierre|McDermid, Sonali P.|Mueller, Christoph|Snyder, Abigail|Thorburn, Peter J.",agmip|climate impacts|crop models|integrated assessment models|agricultural impacts|emulators|model development,10.1088/1748-9326/aa8da6,ENVIRONMENTAL RESEARCH LETTERS,WOS:000417531000001,An AgMIP framework for improved agricultural representation in integrated assessment models,2017,https://dx.doi.org/10.1088/1748-9326/aa8da6
764,"Kumar, Nirmal|Singh, Sudhir Kumar|Srivastava, Prashant K.|Narsimlu, Boini",tons|sufi-2 algorithm|uncertainty analysis|calibration|validation,10.1007/s40808-017-0306-z,MODELING EARTH SYSTEMS AND ENVIRONMENT,WOS:000432216000030,"SWAT Model calibration and uncertainty analysis for streamflow prediction of the Tons River Basin, India, using Sequential Uncertainty Fitting (SUFI-2) algorithm",2017,https://dx.doi.org/10.1007/s40808-017-0306-z
771,"Chadalawada, Jayashree|Havlicek, Vojtech|Babovic, Vladan",automatic model generation|conceptual modelling|genetic programming|rainfall-runoff models|system identification,10.1007/s11269-017-1719-1,WATER RESOURCES MANAGEMENT,WOS:000407831200017,A Genetic Programming Approach to System Identification of Rainfall-Runoff Models,2017,https://dx.doi.org/10.1007/s11269-017-1719-1
774,"Fenton, O.|Mellander, P. -E.|Daly, K.|Wall, D. P.|Jahangir, M. M. R.|Jordan, P.|Hennessey, D.|Huebsch, M.|Blum, P.|Vero, S.|Richard, K. G.",nitrogen|phosphorus|time lag|agriculture|water|soil,10.1016/j.agee.2017.01.014,AGRICULTURE ECOSYSTEMS & ENVIRONMENT,WOS:000397550100025,Integrated assessment of agricultural nutrient pressures and legacies in karst landscapes,2017,https://dx.doi.org/10.1016/j.agee.2017.01.014
775,"Schwartz, Franklin W.|Liu, Ganming|Aggarwal, Pradeep|Schwartz, Cynthia M.",,10.1111/gwat.12570,GROUNDWATER,WOS:000411178100020,Naive Simplicity: The Overlooked Piece of the Complexity-Simplicity Paradigm,2017,https://dx.doi.org/10.1111/gwat.12570
778,"Khanh Nguyen-Trong, |Anh Nguyen-Thi-Ngoc, |Doanh Nguyen-Ngoc, |Van Dinh-Thi-Hai, ",municipal solid waste management|route optimization|environmental modelling|dynamic modelling|agent-based model|equation-based model|vehicle routing model,10.1016/j.wasman.2016.10.048,WASTE MANAGEMENT,WOS:000390503000003,"Optimization of municipal solid waste transportation by integrating GIS analysis, equation-based, and agent-based model",2017,https://dx.doi.org/10.1016/j.wasman.2016.10.048
779,"van der Sande, Masha T.|Poorter, Lourens|Balvanera, Patricia|Kooistra, Lammert|Thonicke, Kirsten|Boit, Alice|Dutrieux, Loic P.|Equihua, Julian|Gerard, France|Herold, Martin|Kolb, Melanie|Simoes, Margareth|Pena-Claros, Marielos",,10.1016/j.cosust.2017.01.016,CURRENT OPINION IN ENVIRONMENTAL SUSTAINABILITY,WOS:000417390100011,"The integration of empirical, remote sensing and modelling approaches enhances insight in the role of biodiversity in climate change mitigation by tropical forests",2017,https://dx.doi.org/10.1016/j.cosust.2017.01.016
783,"Long, Anh-Toan Bui|Ouhammou, Yassine|Grolleau, Emmanuel",real-time|real-time analysis|network|model driven engineering|design|modeling,10.1109/AICCSA.2017.157,2017 IEEE/ACS 14TH INTERNATIONAL CONFERENCE ON COMPUTER SYSTEMS AND APPLICATIONS (AICCSA),WOS:000428311600130,Leveraging Real-Time Network Analyses by Extending a Model-based Framework,2017,https://dx.doi.org/10.1109/AICCSA.2017.157
784,"Paparrizos, Spyridon|Matzarakis, Andreas",arcswat|climate change|greece|hydrological modelling|ipcc scenarios|streamflow,10.2166/nh.2016.018,HYDROLOGY RESEARCH,WOS:000412412500012,Assessment of future climate change impacts on the hydrological regime of selected Greek areas with different climate conditions,2017,https://dx.doi.org/10.2166/nh.2016.018
785,"Hof, Andries F.|den Elzen, Michel G. J.|Admiraal, Annemiek|Roelfsema, Mark|Gernaat, David E. H. J.|van Vuuren, Detlef P.",paris agreement|indcs|ndcs|abatement costs|greenhouse gas emissions|emission trading,10.1016/j.envsci.2017.02.008,ENVIRONMENTAL SCIENCE & POLICY,WOS:000398753300004,Global and regional abatement costs of Nationally Determined Contributions (NDCs) and of enhanced action to levels well below 2 degrees C and 1.5 degrees C,2017,https://dx.doi.org/10.1016/j.envsci.2017.02.008
787,"Yi, Bing|Li, Xiongbing|Yang, Yue",semantic feature extraction|level set method|model integration|heterogeneous model,10.1007/s00366-016-0498-2,ENGINEERING WITH COMPUTERS,WOS:000410805400006,Heterogeneous model integration of complex mechanical parts based on semantic feature fusion,2017,https://dx.doi.org/10.1007/s00366-016-0498-2
793,"Nikiforakis, I. K.|Stamou, A. I.|Christodoulou, G. C.",desalination|brine discharges|near-field models|far-field models|integrated models,10.1007/s10652-016-9473-0,ENVIRONMENTAL FLUID MECHANICS,WOS:000410853200004,Integrated modeling of single port brine discharges into unstratified stagnant ambient,2017,https://dx.doi.org/10.1007/s10652-016-9473-0
794,"Darnell, Kelly M.|Carruthers, Tim J. B.|Biber, Patrick|Georgiou, Ioannis Y.|Michot, Thomas C.|Boustany, Ronald G.",seagrass|louisiana|chandeleur islands|nitrogen|phosphorus,10.1007/s12237-017-0229-y,ESTUARIES AND COASTS,WOS:000406333700006,"Spatial and Temporal Patterns in Thalassia testudinum Leaf Tissue Nutrients at the Chandeleur Islands, Louisiana, USA",2017,https://dx.doi.org/10.1007/s12237-017-0229-y
795,"Lahtinen, Tuomas J.|Guillaume, Joseph H. A.|Hamalainen, Raimo P.",path dependence|biases|behavior|decision making|policy making|problem solving,10.1016/j.envsoft.2017.02.019,ENVIRONMENTAL MODELLING & SOFTWARE,WOS:000401110400006,Why pay attention to paths in the practice of environmental modelling?,2017,https://dx.doi.org/10.1016/j.envsoft.2017.02.019
797,"Chacon-Hurtado, Juan C.|Alfonso, Leonardo|Solomatine, Dimitri P.",,10.5194/hess-21-3071-2017,HYDROLOGY AND EARTH SYSTEM SCIENCES,WOS:000404485600001,"Rainfall and streamflow sensor network design: a review of applications, classification, and a proposed framework",2017,https://dx.doi.org/10.5194/hess-21-3071-2017
798,"Pradhan, Ananta Man Singh|Kang, Hyo-Sub|Lee, Saro|Kim, Yun-Tae",evidential belief function (ebf)|integrated landslide susceptibility|runout propagation,10.1080/10106049.2016.1155658,GEOCARTO INTERNATIONAL,WOS:000395143900005,"Spatial model integration for shallow landslide susceptibility and its runout using a GIS-based approach in Yongin, Korea",2017,https://dx.doi.org/10.1080/10106049.2016.1155658
800,"Gonzalez-Eguino, Mikel|Neumann, Marc B.|Arto, Inaki|Capellan-Perez, Inigo|Faria, Sergio H.",sea-ice-albedo feedback|arctic|mitigation|integrated assessment|abrupt|rapid climate change|social sciences,10.1002/2016EF000429,EARTHS FUTURE,WOS:000395001800006,Mitigation implications of an ice-free summer in the Arctic Ocean,2017,https://dx.doi.org/10.1002/2016EF000429
801,"Hornsby, C.|Ripa, M.|Vassillo, C.|Ulgiati, S.",sustainable transition|solid waste management|biomass fuels|participatory decision-making|stakeholder consultancy|sustainability science,10.1016/j.jclepro.2016.06.189,JOURNAL OF CLEANER PRODUCTION,WOS:000391897300015,A roadmap towards integrated assessment and participatory strategies in support of decision-making processes. The case of urban waste management,2017,https://dx.doi.org/10.1016/j.jclepro.2016.06.189
803,"Gaedeke, Anne|Pohle, Ina|Koch, Hagen|Gruenewald, Uwe",trends analysis|change points|regional climate models|water management|stakeholder outreach|global dimming,10.1007/s10113-017-1138-0,REGIONAL ENVIRONMENTAL CHANGE,WOS:000405800600015,Trend analysis for integrated regional climate change impact assessments in the Lusatian river catchments (north-eastern Germany),2017,https://dx.doi.org/10.1007/s10113-017-1138-0
881,"Moges, Mamaru A.|Schmitter, Petra|Tilahun, Seifu A.|Langan, Simon|Dagnew, Dessalegn C.|Akale, Adugnaw T.|Steenhuis, Tammo S.",catchment hydrology|distributed hydrology modeling|land degradation|saturation excess|lake tana basin,10.1002/ldr.2608,LAND DEGRADATION & DEVELOPMENT,WOS:000401322900021,Suitability of Watershed Models to Predict Distributed Hydrologic Response in the Awramba Watershed in Lake Tana Basin,2017,https://dx.doi.org/10.1002/ldr.2608
882,"Ward, Ben|Selby, Andrew|Gee, Simon|Savic, Dragan",asset management|infrastructure|gis|pipelines|deterioration modelling,10.1080/1573062X.2016.1254252,URBAN WATER JOURNAL,WOS:000404905800011,Deterioration modelling of small-diameter water pipes under limited data availability,2017,https://dx.doi.org/10.1080/1573062X.2016.1254252
884,"Yazdi, J.",flood|surrogate modelling|check dam|optimization|uncertainty|copula,10.1080/02626667.2017.1346376,HYDROLOGICAL SCIENCES JOURNAL-JOURNAL DES SCIENCES HYDROLOGIQUES,WOS:000407513300011,Check dam layout optimization on the stream network for flood mitigation: surrogate modelling with uncertainty handling,2017,https://dx.doi.org/10.1080/02626667.2017.1346376
885,"Meng, Xianyong|Wang, Hao",east asia|cmads|meteorological input uncertainty|hydrological modelling|swat|non-point source pollution models,10.3390/w9100765,WATER,WOS:000414707500042,Significance of the China Meteorological Assimilation Driving Datasets for the SWAT Model (CMADS) of East Asia,2017,https://dx.doi.org/10.3390/w9100765
956,"Monier, Erwan|Kicklighter, David W.|Sokolov, Andrei P.|Zhuang, Qianlai|Sokolik, Irina N.|Lawford, Richard|Kappas, Martin|Paltsev, Sergey V.|Groisman, Pavel Ya",global change|northern eurasia|neespi|earth system model|integrated assessment model|coupled human-earth system,10.1088/1748-9326/aa7aae,ENVIRONMENTAL RESEARCH LETTERS,WOS:000407206700001,A review of and perspectives on global change modeling for Northern Eurasia,2017,https://dx.doi.org/10.1088/1748-9326/aa7aae
