169,WOS:000357345300008,2015,Quantification of Climate Change Impact on Regional Agricultural Irrigation and Groundwater Demand,"Kreins, Peter|Henseler, Martin|Anter, Jano|Herrmann, Frank|Wendland, Frank",WATER RESOURCES MANAGEMENT,climate change|irrigation|groundwater|integrated modelling|regional modelling|agricultural production,10.1007/s11269-015-1017-8,http://dx.doi.org/10.1007/s11269-015-1017-8
168,WOS:000363483800003,2015,Characterizing the effects of policy instruments on the future costs of carbon capture for coal power plants,"Nemet, Gregory F.|Baker, Erin|Barron, Bob|Harms, Samuel",CLIMATIC CHANGE,carbon capture|technological change|climate policy,10.1007/s10584-015-1469-0,http://dx.doi.org/10.1007/s10584-015-1469-0
167,WOS:000359429500005,2015,Modelling of wildfire impacts on catchment hydrology applied to two case studies,"Mahat, Vinod|Anderson, Axel|Silins, Uldis",HYDROLOGICAL PROCESSES,hydrological modelling|change detection|wildfire|catchment,10.1002/hyp.10462,http://dx.doi.org/10.1002/hyp.10462
163,WOS:000366771400065,2015,"Heavy metals distribution and environmental quality assessment for sediments off the southern coast of the Shandong Peninsula, China","Liu, Shanshan|Zhang, Yong|Bi, Shipu|Zhang, Xiaobo|Li, Xiaoyue|Lin, Manman|Hu, Gang",MARINE POLLUTION BULLETIN,the southern coast of the shandong peninsula|sediment|heavy metals|environmental assessment,10.1016/j.marpolbul.2015.09.028,http://dx.doi.org/10.1016/j.marpolbul.2015.09.028
158,WOS:000350668300002,2015,Critical Erosion Area Identification Based on Hydrological Response Unit Level for Effective Sedimentation Control in a River Basin,"Kumar, Sanjeet|Mishra, Ashok",WATER RESOURCES MANAGEMENT,swat|soil erosion|watershed|prioritization|hrus,10.1007/s11269-014-0909-3,http://dx.doi.org/10.1007/s11269-014-0909-3
2060,WOS:000353715400016,2015,Resilience Assessment of Lowland Plantations Using an Ecosystem Modeling Approach,"Wu, Chia-Hsin|Lo, Yueh-Hsin|Blanco, Juan A.|Chang, Shih-Chieh",SUSTAINABILITY,,10.3390/su7043801,http://dx.doi.org/10.3390/su7043801
154,WOS:000365309400012,2015,Development of an integrated policy making tool for assessing air quality and human health benefits of air pollution control,"Qiu, Xuezhen|Zhu, Yun|Jang, Carey|Lin, Che-Jen|Wang, Shuxiao|Fu, Joshua|Xie, Junping|Wang, Jiandong|Ding, Dian|Long, Shicheng",FRONTIERS OF ENVIRONMENTAL SCIENCE & ENGINEERING,air quality assessment|human health benefit|economic benefit|air quality attainment assessment|air pollution control strategy|decision support system,10.1007/s11783-015-0796-8,http://dx.doi.org/10.1007/s11783-015-0796-8
2064,WOS:000352822700002,2015,Multi-Objective Optimal Design of Detention Tanks in the Urban Stormwater Drainage System: Framework Development and Case Study,"Li, Fei|Duan, Huan-Feng|Yan, Hexiang|Tao, Tao",WATER RESOURCES MANAGEMENT,detention tank|local design criteria|multi-objective optimization (moo)|return period|swmm|urban stormwater drainage system (usds),10.1007/s11269-015-0931-0,http://dx.doi.org/10.1007/s11269-015-0931-0
2089,WOS:000366649200003,2015,A Proposal of Requirements Management Ontology: Dependency Relationships among Practices included at CMMI-DEV Level 2 and MR-MPS-SW Level G,"Yoshidome, Ewelton Yoshio|Bezerra Oliveira, Sandro Ronaldo",ABAKOS,ontology|software process quality|relationship|process improvement,10.5752/P.2316-9451.2015v3n2p22,http://dx.doi.org/10.5752/P.2316-9451.2015v3n2p22
147,WOS:000355894700003,2015,"Anatomy of a local-scale drought: Application of assimilated remote sensing products, crop model, and statistical methods to an agricultural drought study","Mishra, Ashok K.|Ines, Amor V. M.|Das, Narendra N.|Khedun, C. Prakash|Singh, Vijay P.|Sivakumar, Bellie|Hansen, James W.",JOURNAL OF HYDROLOGY,drought anatomy|data assimilation|crop yield|copulas|root zone soil moisture,10.1016/j.jhydrol.2014.10.038,http://dx.doi.org/10.1016/j.jhydrol.2014.10.038
2069,WOS:000358138100002,2015,Responses of global terrestrial evapotranspiration to climate change and increasing atmospheric CO2 in the 21st century,"Pan, Shufen|Tian, Hanqin|Dangal, Shree R. S.|Yang, Qichun|Yang, Jia|Lu, Chaoqun|Tao, Bo|Ren, Wei|Ouyang, Zhiyun",EARTHS FUTURE,climate change|evapotranspiration|terrestrial ecosystem modeling|terrestrial ecosystems,10.1002/2014EF000263,http://dx.doi.org/10.1002/2014EF000263
2076,WOS:000357833600005,2015,Validation of finite water-content vadose zone dynamics method using column experiments with a moving water table and applied surface flux,"Ogden, Fred L.|Lai, Wencong|Steinke, Robert C.|Zhu, Jianting",WATER RESOURCES RESEARCH,,10.1002/2014WR016454,http://dx.doi.org/10.1002/2014WR016454
129,WOS:000349889800020,2015,A general reactive transport modeling framework for simulating and interpreting groundwater C-14 age and delta C-13,"Salmon, S. U.|Prommer, H.|Park, J.|Meredith, K. T.|Turner, J. V.|McCallum, J. L.",WATER RESOURCES RESEARCH,c-14|groundwater age|c-13|reactive transport model|organic and inorganic carbon|environmental tracers,10.1002/2014WR015779,http://dx.doi.org/10.1002/2014WR015779
127,WOS:000430386500004,2015,"Evaluating the impacts of climate change and crop land use change on streamflow, nitrates and phosphorus: A modeling study in Bavaria","Mehdi, B.|Ludwig, R.|Lehner, B.",JOURNAL OF HYDROLOGY-REGIONAL STUDIES,hydrological modeling|swat|water quality|crop land use change|agriculture|climate change,10.1016/j.ejrh.2015.04.009,http://dx.doi.org/10.1016/j.ejrh.2015.04.009
2084,WOS:000212556300006,2015,"Cloud to coast: integrated assessment of environmental exposure, health impacts and risk perceptions of faecal organisms in coastal waters","Huang, Guoxian|Falconer, Roger A.|Boye, Brian A.|Lin, Binliang",INTERNATIONAL JOURNAL OF RIVER BASIN MANAGEMENT,cloud to coast (c2c)|faecal indicator organisms|river ribble|environmental exposure and health impacts|numerical modelling|quantitative microbial risk assessment (qmra),10.1080/15715124.2014.963863,http://dx.doi.org/10.1080/15715124.2014.963863
2087,WOS:000348879900045,2015,Modeling two-fluid-phase flow and species transport in porous media,"Rybak, I. V.|Gray, W. G.|Miller, C. T.",JOURNAL OF HYDROLOGY,tcat|porous medium|multiphase flow|species transport|model formulation,10.1016/j.jhydrol.2014.11.051,http://dx.doi.org/10.1016/j.jhydrol.2014.11.051
2088,WOS:000351402800011,2015,The role of local-scale heterogeneities in terrestrial ecosystem modeling,"Pappas, Christoforos|Fatichi, Simone|Rimkus, Stefan|Burlando, Paolo|Huber, Markus O.",JOURNAL OF GEOPHYSICAL RESEARCH-BIOGEOSCIENCES,vegetation modeling|ecohydrology|aggregation biases|fallacy of averages|lpj|topkapi-eth,10.1002/2014JG002735,http://dx.doi.org/10.1002/2014JG002735
78,WOS:000351808400003,2015,A quantitative model of first language influence in second language consonant learning,"Gong, Jim|Cooke, Martin|Garcia Lecumberri, Maria Luisa",SPEECH COMMUNICATION,foreign language sound acquisition|consonant identification|rapid learning|computer model,10.1016/j.specom.2015.02.003,http://dx.doi.org/10.1016/j.specom.2015.02.003
75,WOS:000359347400006,2015,A general framework of chlorine decay modeling at a pilot-scale water distribution system,"Kim, Hyunjun|Koo, Jayong|Kim, Sanghyun",JOURNAL OF WATER SUPPLY RESEARCH AND TECHNOLOGY-AQUA,chlorine decay model|hydraulic condition|water distribution system,10.2166/aqua.2014.039,http://dx.doi.org/10.2166/aqua.2014.039
172,WOS:000358179400017,2015,Accounting for radiative forcing from albedo change in future global land-use scenarios,"Jones, Andrew D.|Calvin, Katherine V.|Collins, William D.|Edmonds, James",CLIMATIC CHANGE,,10.1007/s10584-015-1411-5,http://dx.doi.org/10.1007/s10584-015-1411-5
10,WOS:000352205300016,2015,"Investigating the nexus of climate, energy, water, and land at decision-relevant scales: the Platform for Regional Integrated Modeling and Analysis (PRIMA)","Kraucunas, Ian|Clarke, Leon|Dirks, James|Hathaway, John|Hejazi, Mohamad|Hibbard, Kathy|Huang, Maoyi|Jin, Chunlian|Kintner-Meyer, Michael|van Dam, Kerstin Kleese|Leung, Ruby|Li, Hong-Yi|Moss, Richard|Peterson, Marty|Rice, Jennie|Scott, Michael|Thomson, Allison|Voisin, Nathalie|West, Tristram",CLIMATIC CHANGE,,10.1007/s10584-014-1064-9,http://dx.doi.org/10.1007/s10584-014-1064-9
28,WOS:000349505400017,2015,Ecosystem services and economic development in Austrian agricultural landscapes - The impact of policy and climate change scenarios on trade-offs and synergies,"Kirchner, Mathias|Schmidt, Johannes|Kindermann, Georg|Kulmer, Veronika|Mitter, Herrnine|Prettenthaler, Franz|Ruedisser, Johannes|Schauppenlehner, Thomas|Schoenhart, Martin|Strauss, Franziska|Tappeiner, Ulrike|Tasser, Erich|Schmid, Erwin",ECOLOGICAL ECONOMICS,agricultural ecosystem services|integrated modeling|policy impact analysis|regional climate change|macro-economic indicators|biodiversity and landscape metrics,10.1016/j.ecolecon.2014.11.005,http://dx.doi.org/10.1016/j.ecolecon.2014.11.005
2187,WOS:000360864700003,2015,Automatic multi-resolution shape modeling of multi-organ structures,"Cerrolaza, Juan J.|Reyes, Mauricio|Summers, Ronald M.|Gonzalez-Ballester, Miguel Angel|Linguraru, Marius George",MEDICAL IMAGE ANALYSIS,point distribution model (pdm)|multi-resolution|hierarchical modeling|statistical shape model|active shape model,10.1016/j.media.2015.04.003,http://dx.doi.org/10.1016/j.media.2015.04.003
27,WOS:000380539900003,2015,Motivating Use Cases for the Globalization of DSLs,"Cheng, Betty H. C.|Degueule, Thomas|Atkinson, Colin|Clarke, Siobhan|Frank, Ulrich|Mosterman, Pieter J.|Sztipanovits, Janos|Cheng, BHC|Combemale, B|France, RB|Jezequel, JM|Rumpe, B",GLOBALIZING DOMAIN-SPECIFIC LANGUAGES,multi-model integration|language integration,10.1007/978-3-319-26172-0_3,http://dx.doi.org/10.1007/978-3-319-26172-0_3
2191,WOS:000366332200003,2015,A coupled surface-subsurface modeling framework to assess the impact of climate change on freshwater wetlands,"Yu, Xuan|Bhatt, Gopal|Duffy, Christopher J.|Wardrop, Denice H.|Najjar, Raymond G.|Ross, Andrew C.|Rydzik, Matthew",CLIMATE RESEARCH,climate change impacts|gcm|spatial patterns|watershed modeling|water table|pihm|wetland|susquehanna river basin,10.3354/cr01348,http://dx.doi.org/10.3354/cr01348
16,WOS:000355026100014,2015,An integrated model-based approach to the risk assessment of pesticide drift from vineyards,"Pivato, Alberto|Barausse, Alberto|Zecchinato, Francesco|Palmeri, Luca|Raga, Roberto|Lavagnolo, Maria Cristina|Cossu, Raffaello",ATMOSPHERIC ENVIRONMENT,pesticide drift|inhalation risk analysis|calpuff|fugacity model,10.1016/j.atmosenv.2015.04.005,http://dx.doi.org/10.1016/j.atmosenv.2015.04.005
2198,WOS:000348879100022,2015,Urban land cover classification using airborne LiDAR data: A review,"Yan, Wai Yeung|Shaker, Ahmed|El-Ashmawy, Nagwa",REMOTE SENSING OF ENVIRONMENT,airborne lidar|laser scanning|lidar intensity|land cover mapping|land cover classification|radiometric calibration|radiometric correction|full-waveform|urban environment|urban analysis,10.1016/j.rse.2014.11.001,http://dx.doi.org/10.1016/j.rse.2014.11.001
12,WOS:000366828900001,2015,Prognostics and Health Management of an Automated Machining Process,"He, Cheng|Li, Jiaming|Vachtsevanos, George",MATHEMATICAL PROBLEMS IN ENGINEERING,,10.1155/2015/651841,http://dx.doi.org/10.1155/2015/651841
11,WOS:000416454600001,2015,The hydrological model and formula for determining the hypothetical flood wave volume in non-gauged basins,"Gadek, Wieslaw|Bodziony, Marek",METEOROLOGY HYDROLOGY AND WATER MANAGEMENT-RESEARCH AND OPERATIONAL APPLICATIONS,theoretical flood wave|hypothetical flood wave|unified unit hydrograph uhg scs|non-gauged catchment|reduced volume|the krakow method,10.26491/mhwm/41759,http://dx.doi.org/10.26491/mhwm/41759
8,WOS:000365268600004,2015,A functional-dynamic reflection on participatory processes in modeling projects,"Seidl, Roman",AMBIO,modeling|stakeholders|review|functions of participation|transdisciplinarity|interdisciplinarity,10.1007/s13280-015-0670-8,http://dx.doi.org/10.1007/s13280-015-0670-8
2183,WOS:000353073700003,2015,Reusability of model components for environmental simulation - Case studies for integrated coastal zone management,"de Kok, Jean-Luc|Engelen, Guy|Maes, Joachim",ENVIRONMENTAL MODELLING & SOFTWARE,component reusability|component-based modelling|model library|system dynamics|integrated coastal zone management,10.1016/j.envsoft.2015.02.001,http://dx.doi.org/10.1016/j.envsoft.2015.02.001
2205,WOS:000349012200038,2015,Estimating farmers' willingness to pay for climate change adaptation: the case of the Malaysian agricultural sector,"Masud, Muhammad Mehedi|Ha Junsheng, |Akhtar, Rulia|Al-Amin, Abul Quasem|Kari, Fatimah Binti",ENVIRONMENTAL MONITORING AND ASSESSMENT,adaptation|agriculture|climate change|willingness to pay (wtp)|contingent valuation method (cvm),10.1007/s10661-014-4254-z,http://dx.doi.org/10.1007/s10661-014-4254-z
2206,WOS:000355035600011,2015,Impacts of agri-environmental policy on land use and nitrogen leaching in Finland,"Lehtonen, Heikki|Rankinen, Katri",ENVIRONMENTAL SCIENCE & POLICY,agricultural production|nutrient leaching|agricultural economics|hydrological modeling,10.1016/j.envsci.2015.02.001,http://dx.doi.org/10.1016/j.envsci.2015.02.001
7,WOS:000351971700058,2015,Addressing subjective decision-making inherent in GLUE-based multi-criteria rainfall-runoff model calibration,"Shafii, Mahyar|Tolson, Bryan|Matott, L. Shawn",JOURNAL OF HYDROLOGY,uncertainty|multi-criteria calibration|rainfall-runoff modelling|glue,10.1016/j.jhydrol.2015.01.051,http://dx.doi.org/10.1016/j.jhydrol.2015.01.051
2209,WOS:000360537700032,2015,An integrated assessment of the impact of precipitation and groundwater on vegetation growth in arid and semiarid areas,"Zhu, Lin|Gong, Huili|Dai, Zhenxue|Xu, Tingbao|Su, Xiaosi",ENVIRONMENTAL EARTH SCIENCES,spatial-temporal analysis|groundwater|vadose zone|normalized difference vegetation index|numerical simulation|plant water uptake|northern china,10.1007/s12665-015-4513-5,http://dx.doi.org/10.1007/s12665-015-4513-5
2210,WOS:000357147200007,2015,The implications of carbon dioxide and methane exchange for the heavy mitigation RCP2.6 scenario under two metrics,"Huntingford, Chris|Lowe, Jason A.|Howarth, Nicholas|Bowerman, Niel H. A.|Gohar, Laila K.|Otto, Alexander|Lee, David S.|Smith, Stephen M.|den Elzen, Michel G. J.|van Vuuren, Detlef P.|Millar, Richard J.|Allen, Myles R.",ENVIRONMENTAL SCIENCE & POLICY,climate change|greenhouse gases|metrics|mac curves|carbon dioxide emissions|methane emissions,10.1016/j.envsci.2015.03.013,http://dx.doi.org/10.1016/j.envsci.2015.03.013
5,WOS:000363089300012,2015,Hierarchical Modeling and Parameter Estimation for a Coupled Groundwater-Lake System,"Liao, Hua-Sheng|Sampath, Prasanna V.|Curtis, Zachary K.|Li, Shu-Guang",JOURNAL OF HYDROLOGIC ENGINEERING,groundwater-lake interaction|parameter estimation|multiscale,10.1061/(ASCE)HE.1943-5584.0001219,http://dx.doi.org/10.1061/(ASCE)HE.1943-5584.0001219
2214,WOS:000358968200025,2015,Variance-based global sensitivity analysis for multiple scenarios and models with implementation using sparse grid collocation,"Dai, Heng|Ye, Ming",JOURNAL OF HYDROLOGY,model uncertainty|model averaging|scenario uncertainty|scenario averaging|variance decomposition|sparse grid collocation,10.1016/j.jhydrol.2015.06.034,http://dx.doi.org/10.1016/j.jhydrol.2015.06.034
3,WOS:000348802400013,2015,Exploring climate change vulnerability across sectors and scenarios using indicators of impacts and coping capacity,"Dunford, R.|Harrison, P. A.|Jaeger, J.|Rounsevell, M. D. A.|Tinch, R.",CLIMATIC CHANGE,,10.1007/s10584-014-1162-8,http://dx.doi.org/10.1007/s10584-014-1162-8
29,WOS:000363348900086,2015,A modeling framework for characterizing near-road air pollutant concentration at community scales,"Chang, Shih Ying|Vizuete, William|Valencia, Alejandro|Naess, Brian|Isakov, Vlad|Palma, Ted|Breen, Michael|Arunachalam, Saravanan",SCIENCE OF THE TOTAL ENVIRONMENT,dispersion|air pollution|high-resolution modeling|traffic|near-road exposure|r-line|metare|emissions,10.1016/j.scitotenv.2015.06.139,http://dx.doi.org/10.1016/j.scitotenv.2015.06.139
31,WOS:000366769800005,2015,"Assessing the capability of the SWAT model to simulate snow, snow melt and streamflow dynamics over an alpine watershed","Grusson, Youen|Sun, Xiaoling|Gascoin, Simon|Sauvage, Sabine|Raghavan, Srinivasan|Anctil, Francois|Sachez-Perez, Jose-Miguel",JOURNAL OF HYDROLOGY,swat|modis|hydrological modelling|snow simulation|elevation band|garonne river,10.1016/j.jhydrol.2015.10.070,http://dx.doi.org/10.1016/j.jhydrol.2015.10.070
2142,WOS:000351978000016,2015,Assessing the cost-effectiveness of electric vehicles in European countries using integrated modeling,"Seixas, J.|Simoes, S.|Dias, L.|Kanudia, A.|Fortes, P.|Gargiulo, M.",ENERGY POLICY,electric vehicles|optimization|technology costs|co2 emissions|european countries,10.1016/j.enpol.2015.01.032,http://dx.doi.org/10.1016/j.enpol.2015.01.032
51,WOS:000350557400009,2015,"Reimagining the past - use of counterfactual trajectories in socio-hydrological modelling: the case of Chennai, India","Srinivasan, V.",HYDROLOGY AND EARTH SYSTEM SCIENCES,,10.5194/hess-19-785-2015,http://dx.doi.org/10.5194/hess-19-785-2015
2143,WOS:000356741300007,2015,A Matlab toolbox for Global Sensitivity Analysis,"Pianosi, Francesca|Sarrazin, Fanny|Wagener, Thorsten",ENVIRONMENTAL MODELLING & SOFTWARE,global sensitivity analysis|matlab|octave|open-source software,10.1016/j.envsoft.2015.04.009,http://dx.doi.org/10.1016/j.envsoft.2015.04.009
2145,WOS:000353877000025,2015,Inter-comparison of energy balance and hydrological models for land surface energy flux estimation over a whole river catchment,"Guzinski, R.|Nieto, H.|Stisen, S.|Fensholt, R.",HYDROLOGY AND EARTH SYSTEM SCIENCES,,10.5194/hess-19-2017-2015,http://dx.doi.org/10.5194/hess-19-2017-2015
62,WOS:000365889400001,2015,Multibaseline polarimetric synthetic aperture radar tomography of forested areas using wavelet-based distribution compressive sensing,"Liang, Lei|Li, Xinwu|Gao, Xizhang|Guo, Huadong",JOURNAL OF APPLIED REMOTE SENSING,polarimetric synthetic aperture radar|synthetic aperture radar tomography|distributed compressive sensing|sparse representations,10.1117/1.JRS.9.095048,http://dx.doi.org/10.1117/1.JRS.9.095048
59,WOS:000368418400013,2015,Exploring the water storage changes in the largest lake (Selin Co) over the Tibetan Plateau during 2003-2012 from a basin-wide hydrological modeling,"Zhou, Jing|Wang, Lei|Zhang, Yinsheng|Guo, Yanhong|Li, Xiuping|Liu, Wenbin",WATER RESOURCES RESEARCH,,10.1002/2014WR015846,http://dx.doi.org/10.1002/2014WR015846
2158,WOS:000357118200009,2015,"Benefits of greenhouse gas mitigation on the supply, management, and use of water resources in the United States","Strzepek, K.|Neumann, J.|Smith, J.|Martinich, J.|Boehlert, B.|Hejazi, M.|Henderson, J.|Wobus, C.|Jones, R.|Calvin, K.|Johnson, D.|Monier, E.|Strzepek, J.|Yoon, J. -H.",CLIMATIC CHANGE,,10.1007/s10584-014-1279-9,http://dx.doi.org/10.1007/s10584-014-1279-9
56,WOS:000350327700020,2015,Temperature impacts on economic growth warrant stringent mitigation policy,"Moore, Frances C.|Diaz, Delavane B.",NATURE CLIMATE CHANGE,,10.1038/NCLIMATE2481,http://dx.doi.org/10.1038/NCLIMATE2481
2160,WOS:000362533500004,2015,"Production risk, inter-annual food storage by households and population-level consequences in seasonal prehistoric agrarian societies","Winterhalder, Bruce|Puleston, Cedric|Ross, Cody",ENVIRONMENTAL ARCHAEOLOGY,risk|surplus|storage|prehistoric agro-ecology|food-limited demography|environmental anthropology,10.1179/1749631415Y.0000000025,http://dx.doi.org/10.1179/1749631415Y.0000000025
55,WOS:000357020200012,2015,An Integrated Assessment for Wind Energy in Lake Michigan Coastal Counties,"Nordman, Erik|VanderMolen, Jon|Gajewski, Betty|Isely, Paul|Fan, Yue|Koches, John|Damm, Sara|Ferguson, Aaron|Schoolmaster, Claire",INTEGRATED ENVIRONMENTAL ASSESSMENT AND MANAGEMENT,delphi inquiry|integrated assessment|lake michigan|wind energy|offshore wind,10.1002/ieam.1602,http://dx.doi.org/10.1002/ieam.1602
46,WOS:000358330800063,2015,Quantitative and qualitative assessment of the impact of climate change on a combined sewer overflow and its receiving water body,"Bi, Eustache Goore|Monette, Frederic|Gachon, Philippe|Gasperi, Johnny|Perrodin, Yves",ENVIRONMENTAL SCIENCE AND POLLUTION RESEARCH,climate change (cc) impact study|combined sewer overflows (csos)|hydrological modeling|extreme,10.1007/s11356-015-4411-0,http://dx.doi.org/10.1007/s11356-015-4411-0
32,WOS:000348879900004,2015,"Separating snow, clean and debris covered ice in the Upper Indus Basin, Hindukush-Karakoram-Himalayas, using Landsat images between 1998 and 2002","Khan, Asif|Naz, Bibi S.|Bowling, Laura C.",JOURNAL OF HYDROLOGY,ela|aar|glacier inventory|upper indus basin|snow and glaciers,10.1016/j.jhydrol.2014.11.048,http://dx.doi.org/10.1016/j.jhydrol.2014.11.048
45,WOS:000361630800002,2015,Approaching tipping points: a focussed review of indicators and relevance to managing intertidal ecosystems,"Eslami-Andergoli, L.|Dale, P. E. R.|Knight, J. M.|McCallum, H.",WETLANDS ECOLOGY AND MANAGEMENT,tipping point indicators|catastrophic change|state change|ecosystem modelling|intertidal wetlands|management,10.1007/s11273-014-9352-8,http://dx.doi.org/10.1007/s11273-014-9352-8
2167,WOS:000361906400026,2015,Crop modelling for integrated assessment of risk to food production from climate change,"Ewert, F.|Rotter, R. P.|Bindi, M.|Webber, H.|Trnka, M.|Kersebaum, K. C.|Olesen, J. E.|van Ittersum, M. K.|Janssen, S.|Rivington, M.|Semenov, M. A.|Wallach, D.|Porter, J. R.|Stewart, D.|Verhagen, J.|Gaiser, T.|Palosuo, T.|Tao, F.|Nendel, C.|Roggero, P. P.|Bartosova, L.|Asseng, S.",ENVIRONMENTAL MODELLING & SOFTWARE,uncertainty|scaling|integrated assessment|risk assessment|adaptation|crop models,10.1016/j.envsoft.2014.12.003,http://dx.doi.org/10.1016/j.envsoft.2014.12.003
2169,WOS:000360769300010,2015,"The Hydrological Status Concept: Application at a Temporary River (Candelaro, Italy)","De Girolamo, A. M.|Lo Porto, A.|Pappagallo, G.|Tzoraki, O.|Gallart, F.",RIVER RESEARCH AND APPLICATIONS,temporary streams|hydrological regime|hydrological modelling|water framework directive,10.1002/rra.2786,http://dx.doi.org/10.1002/rra.2786
2170,WOS:000360060700013,2015,Investigations of uncertainty in SWAT hydrologic simulations: a case study of a Canadian Shield catchment,"Fu, Congsheng|James, April L.|Yao, Huaxia",HYDROLOGICAL PROCESSES,swat|uncertainty|glue|snow water equivalent|harp lake,10.1002/hyp.10477,http://dx.doi.org/10.1002/hyp.10477
43,WOS:000358074700007,2015,Turning Rate Dynamics of Zebrafish Exposed to Ethanol,"Mwaffo, Violet|Porfiri, Maurizio",INTERNATIONAL JOURNAL OF BIFURCATION AND CHAOS,behavior|ethanol|stochastic differential equations|turning rate|zebrafish,10.1142/S0218127415400064,http://dx.doi.org/10.1142/S0218127415400064
41,WOS:000360456600005,2015,A comprehensive view of global potential for hydro-generated electricity,"Zhou, Y.|Hejazi, M.|Smith, S.|Edmonds, J.|Li, H.|Clarke, L.|Calvin, K.|Thomson, A.",ENERGY & ENVIRONMENTAL SCIENCE,,10.1039/c5ee00888c,http://dx.doi.org/10.1039/c5ee00888c
39,WOS:000355770700009,2015,Estimating the value of carbon sequestration ecosystem services in the Mediterranean Sea: An ecological economics approach,"Canu, Donata Melaku|Ghermandi, Andrea|Nunes, Paulo A. L. D.|Lazzari, Paolo|Cossarini, Gianpiero|Solidoro, Cosimo",GLOBAL ENVIRONMENTAL CHANGE-HUMAN AND POLICY DIMENSIONS,blue carbon|carbon sequestration|ecosystem services|integrated assessment|mediterranean sea|regulating services,10.1016/j.gloenvcha.2015.02.008,http://dx.doi.org/10.1016/j.gloenvcha.2015.02.008
37,WOS:000357813400002,2015,Green Balance Software: An Integrated Model for Screening of CO2-EOR and CCS Projects,"Ghoodjani, E.|Bolouri, S. H.",ENERGY SOURCES PART A-RECOVERY UTILIZATION AND ENVIRONMENTAL EFFECTS,carbon capture and storage|co2 sequestration|enhanced oil recovery|integrated modeling,10.1080/15567036.2011.631965,http://dx.doi.org/10.1080/15567036.2011.631965
2050,WOS:000364528800013,2015,Modelling the occurrence of gullies at two spatial scales in the Oltet Drainage Basin (Romania),"Jurchescu, Marta|Grecu, Florina",NATURAL HAZARDS,gully erosion|prediction|cart|gully density|gully susceptibility|top-down approach|scale dependency,10.1007/s11069-015-1981-6,http://dx.doi.org/10.1007/s11069-015-1981-6
2046,WOS:000349888400011,2015,"Managed Aquifer Recharge As a Key Element in Sonora River Basin Management, Mexico","Palma, A.|Gonzalez, F.|Cruickshank, C.",JOURNAL OF HYDROLOGIC ENGINEERING,,10.1061/(ASCE)HE.1943-5584.0001114,http://dx.doi.org/10.1061/(ASCE)HE.1943-5584.0001114
324,WOS:000360417800039,2015,"Ecologically based targets for bioavailable (reactive) nitrogen discharge from the drainage basins of the Wet Tropics region, Great Barrier Reef","Wooldridge, Scott A.|Brodie, Jon E.|Kroon, Frederieke J.|Turner, Ryan D. R.",MARINE POLLUTION BULLETIN,water quality|coral bleaching|crown-of-thorns starfish|coral health|nutrient enrichment|resilience,10.1016/j.marpolbul.2015.06.007,http://dx.doi.org/10.1016/j.marpolbul.2015.06.007
1956,WOS:000356548800004,2015,An interdisciplinary modelling framework for selecting adaptation measures at the river basin scale in a global change scenario,"Girard, Corentin|Rinaudo, Jean-Daniel|Pulido-Velazquez, Manuel|Caballero, Yvan",ENVIRONMENTAL MODELLING & SOFTWARE,global change|adaptation|integrated river basin modelling|programme of measures|interdisciplinary|least-cost optimisation,10.1016/j.envsoft.2015.02.023,http://dx.doi.org/10.1016/j.envsoft.2015.02.023
