1084,"Baroni, Gabriele|Zink, Matthias|Kumar, Rohini|Samaniego, Luis|Attinger, Sabine",,10.5194/hess-21-2301-2017,HYDROLOGY AND EARTH SYSTEM SCIENCES,WOS:000400579600003,Effects of uncertainty in soil properties on simulated hydrological states and fluxes at different spatio-temporal scales,2017,https://dx.doi.org/10.5194/hess-21-2301-2017
1085,"Wagenbrenner, N. S.|Chung, S. H.|Lamb, B. K.",wildfire|dust|pm10,10.1525/elementa.185,ELEMENTA-SCIENCE OF THE ANTHROPOCENE,WOS:000397954900001,A large source of dust missing in Particulate Matter emission inventories? Wind erosion of post-fire landscapes,2017,https://dx.doi.org/10.1525/elementa.185
1087,"O'Connell, Enda",climate change|climatic variability|socio-economic|adaptation|risk|impacts|vulnerabilty|demand-supply gap|real-time operational control|human system|agent-based modelling,10.1007/s11269-017-1734-2,WATER RESOURCES MANAGEMENT,WOS:000403791300006,Towards Adaptation of Water Resource Systems to Climatic and Socio-Economic Change,2017,https://dx.doi.org/10.1007/s11269-017-1734-2
1088,"Rathinasamy, Maheswaran|Bindhu, V. M.|Adamowski, Jan|Narasimhan, Balaji|Khosa, Rakesh",scaling|ndvi|landsat|wavelet multiresolution|temperature|vegetation,10.1007/s00484-017-1353-x,INTERNATIONAL JOURNAL OF BIOMETEOROLOGY,WOS:000413145100001,Investigation of the scaling characteristics of LANDSAT temperature and vegetation data: a wavelet-based approach,2017,https://dx.doi.org/10.1007/s00484-017-1353-x
1089,"Hannouf, Marwa|Assefa, Getachew",life cycle sustainability assessment|sustainability improvements|high density polyethylene|integrated analysis|strong sustainability model|alberta,10.3390/su9122332,SUSTAINABILITY,WOS:000419231500178,"Life Cycle Sustainability Assessment for Sustainability Improvements: A Case Study of High-Density Polyethylene Production in Alberta, Canada",2017,https://dx.doi.org/10.3390/su9122332
1090,"Pourmokhtarian, Afshin|Driscoll, Charles T.|Campbell, John L.|Hayhoe, Katharine|Stoner, Anne M. K.|Adams, Mary Beth|Burns, Douglas|Fernandez, Ivan|Mitchell, Myron J.|Shanley, James B.",climate change|cmip5|ecohydrology|ecosystem modeling|northeastern united states|water stress|water use efficiency|watershed,10.1111/gcb.13444,GLOBAL CHANGE BIOLOGY,WOS:000394343300033,Modeled ecohydrological responses to climate change at seven small watersheds in the northeastern United States,2017,https://dx.doi.org/10.1111/gcb.13444
1093,"Akdag, Nese Yugruk|Gedik, Gulay Zorer|Kiraz, Fatih|Sener, Bekir",mass housing|noise control|noise barriers|environmental modeling,10.1007/s10661-017-6202-1,ENVIRONMENTAL MONITORING AND ASSESSMENT,WOS:000411166100022,Effect of mass housing settlement type on the comfortable open areas in terms of noise,2017,https://dx.doi.org/10.1007/s10661-017-6202-1
1096,"Dolan, Katelyn A.|Hurtt, George C.|Flanagan, Steve A.|Fisk, Justin P.|Sahajpal, Ritvik|Huang, Chengquan|Le Page, Yannik|Dubayah, Ralph|Masek, Jeffrey G.",forest disturbance|ecological modeling|remote sensing,10.1088/1748-9326/aa8ea9,ENVIRONMENTAL RESEARCH LETTERS,WOS:000424392900006,Disturbance Distance: quantifying forests' vulnerability to disturbance under current and future conditions,2017,https://dx.doi.org/10.1088/1748-9326/aa8ea9
1098,"Shrestha, Rajesh R.|Cannon, Alex J.|Schnorbus, Markus A.|Zwiers, Francis W.",,10.1007/s10584-017-2098-6,CLIMATIC CHANGE,WOS:000417060100003,"Projecting future nonstationary extreme streamflow for the Fraser River, Canada",2017,https://dx.doi.org/10.1007/s10584-017-2098-6
1099,"Deb, Rajdeep|Jenny, Patrick",slip|aperture|friction|xfvm,10.1007/s10596-017-9680-x,COMPUTATIONAL GEOSCIENCES,WOS:000415817200020,Modeling of shear failure in fractured reservoirs with a porous matrix,2017,https://dx.doi.org/10.1007/s10596-017-9680-x
1057,"Liu, Xin|Wang, Ying|Li, Xiaonan|Zou, Li",linguistic truth-valued lattice implication algebra|approximate reasoning|decision making|linguistic-valued similarity,10.2991/ijcis.2017.10.1.21,INTERNATIONAL JOURNAL OF COMPUTATIONAL INTELLIGENCE SYSTEMS,WOS:000397302900021,A Linguistic-Valued Approximate Reasoning Approach for Financial Decision Making,2017,https://dx.doi.org/10.2991/ijcis.2017.10.1.21
1054,"Monteiro, Andreia|Menezes, Raquel|Silva, Maria Eduarda",geostatistics|spatio-temporal modelling|hourly air pollution data|multiple seasonalities,10.1016/j.spasta.2017.04.005,SPATIAL STATISTICS,WOS:000417466000010,Modelling spatio-temporal data with multiple seasonalities: The NO2 Portuguese case,2017,https://dx.doi.org/10.1016/j.spasta.2017.04.005
1234,"McNeish, Daniel",multilevel mediation|multilevel sem|small sample,10.1080/10705511.2017.1280797,STRUCTURAL EQUATION MODELING-A MULTIDISCIPLINARY JOURNAL,WOS:000400681500010,Multilevel Mediation With Small Samples: A Cautionary Note on the Multilevel Structural Equation Modeling Framework,2017,https://dx.doi.org/10.1080/10705511.2017.1280797
1053,"Wu, Naicheng|Dong, Xuhui|Liu, Yang|Wang, Chao|Baattrup-Pedersen, Annette|Riis, Tenna",riverine microalgae|lotic ecosystem functions|trait-based biomonitoring|multiple stressors|global change,10.1016/j.ecolind.20.17.05.066,ECOLOGICAL INDICATORS,WOS:000417229100013,Using river microalgae as indicators for freshwater biomonitoring: Review of published research and future directions,2017,https://dx.doi.org/10.1016/j.ecolind.20.17.05.066
1009,"Bakarji, Joseph|O'Malley, Daniel|Vesselinov, Velimir V.",sociohydrology|decision support systems|computational social dynamics,10.1007/s11269-017-1713-7,WATER RESOURCES MANAGEMENT,WOS:000407831200012,Agent-Based Socio-Hydrological Hybrid Modeling for Water Resource Management,2017,https://dx.doi.org/10.1007/s11269-017-1713-7
1010,"Ryoo, Ji Hoon|Konold, Timothy R.|Long, Jeffrey D.|Molfese, Victoria J.|Zhou, Xin",early childhood mathematics achievement|fractional polynomials|growth mixture models,10.1080/10705511.2017.1335206,STRUCTURAL EQUATION MODELING-A MULTIDISCIPLINARY JOURNAL,WOS:000414099800007,Nonlinear Growth Mixture Models With Fractional Polynomials: An Illustration With Early Childhood Mathematics Ability,2017,https://dx.doi.org/10.1080/10705511.2017.1335206
1012,"Cao, Bo|Yang, Shengmei|Ye, Song",earthquake-induced dammed lakes|flood|potential impact area|estimate|hydrological modeling|rs|gis,10.3390/w9100777,WATER,WOS:000414707500054,"Integrated Application of Remote Sensing, GIS and Hydrological Modeling to Estimate the Potential Impact Area of Earthquake-Induced Dammed Lakes",2017,https://dx.doi.org/10.3390/w9100777
1013,"Yuan, Fei|Zhao, Chongxu|Jiang, Yong|Ren, Liliang|Shan, Hongcui|Zhang, Limin|Zhu, Yonghua|Chen, Tao|Jiang, Shanhu|Yang, Xiaoli|Shen, Hongren","uncertainty|climate change|emission scenario, climate model|statistical downscaling method|hydrological model|extreme flow frequency analysis",10.1016/j.jhydrol.2017.08.034,JOURNAL OF HYDROLOGY,WOS:000415769600032,Evaluation on uncertainty sources in projecting hydrological changes over the Xijiang River basin in South China,2017,https://dx.doi.org/10.1016/j.jhydrol.2017.08.034
1014,"Fratamico, Lauren|Conati, Cristina|Kardan, Samad|Roll, Ido",educational data mining|clustering|user modeling|interactive simulations|exploratory learning environments,10.1007/s40593-016-0131-y,INTERNATIONAL JOURNAL OF ARTIFICIAL INTELLIGENCE IN EDUCATION,WOS:000400065900004,Applying a Framework for Student Modeling in Exploratory Learning Environments: Comparing Data Representation Granularity to Handle Environment Complexity,2017,https://dx.doi.org/10.1007/s40593-016-0131-y
1015,"Robson, Barbara J.|Lester, Rebecca E.|Baldwin, Darren S.|Bond, Nicholas R.|Drouart, Romain|Rolls, Robert J.|Ryder, Darren S.|Thompson, Ross M.",prediction|ecosystems|adaptive river management|food webs|ecohydrology,10.1016/j.watres.2017.07.031,WATER RESEARCH,WOS:000412251500011,Modelling food-web mediated effects of hydrological variability and environmental flows,2017,https://dx.doi.org/10.1016/j.watres.2017.07.031
1016,"Hasbaia, Mahmoud|Paquier, Andre|Herizi, Toufik|Abdalla, O|Kacimov, A|Chen, M|AlMaktoumi, A|AlHosni, T|Clark, ",semiarid region|algeria|sediment transport|hydrologic model|soubella|hodna,10.1007/978-3-319-51856-5_14,WATER RESOURCES IN ARID AREAS: THE WAY FORWARD,WOS:000436089500014,"Hydrological Modeling of Sediment Transport in the Semi-arid Region, Case of Soubella Watershed in Algeria",2017,https://dx.doi.org/10.1007/978-3-319-51856-5_14
1018,"Sagar, Stephen|Roberts, Dale|Bala, Biswajit|Lymburner, Leo",landsat|time-series|tidal modelling|intertidal|coastal|elevation|topography|image compositing,10.1016/j.rse.2017.04.009,REMOTE SENSING OF ENVIRONMENT,WOS:000402355700013,Extracting the intertidal extent and topography of the Australian coastline from a 28 year time series of Landsat observations,2017,https://dx.doi.org/10.1016/j.rse.2017.04.009
1020,"Stoorvogel, Jetse J.|Bakkenes, Michel|Temme, Arnaud J. A. M.|Batjes, Niels H.|ten Brink, Ben J. E.",globalsoilmap|digital soil mapping|rwanda|soil property maps,10.1002/ldr.2656,LAND DEGRADATION & DEVELOPMENT,WOS:000393800400002,S-World: A Global Soil Map for Environmental Modelling,2017,https://dx.doi.org/10.1002/ldr.2656
1021,"Herrera, Josefina|Bonilla, Carlos A.|Castro, Lina|Vera, Sergio|Reyes, Rodolfo|Gironas, Jorge",continuous simulation|soil water content|green infrastructure|hydrological modeling|irrigation|global sensitivity analysis,10.1016/j.envsoft.2017.06.020,ENVIRONMENTAL MODELLING & SOFTWARE,WOS:000406177500019,A model for simulating the performance and irrigation of green stormwater facilities at residential scales in semiarid and Mediterranean regions,2017,https://dx.doi.org/10.1016/j.envsoft.2017.06.020
1025,"Abhinav, S.|Manohar, C. S.",dynamic state estimation|vehicle-structure interactions|rao-blackwellization|component mode synthesis,10.1016/j.apm.2016.10.040,APPLIED MATHEMATICAL MODELLING,WOS:000390501900039,Substructuring tools for probabilistic analysis of instrumented nonlinear moving oscillator-beam systems,2017,https://dx.doi.org/10.1016/j.apm.2016.10.040
1026,"Camanzi, Luca|Alikadic, Azra|Compagnoni, Luca|Merloni, Eva",greenhouse gas emission|eu food supply chain|ee-io approach|e3iot model|environmental impact|social cost,10.1016/j.jclepro.2017.04.118,JOURNAL OF CLEANER PRODUCTION,WOS:000405883600018,The impact of greenhouse gas emissions in the EU food chain: A quantitative and economic assessment using an environmentally extended input-output approach,2017,https://dx.doi.org/10.1016/j.jclepro.2017.04.118
1027,"Rasanen, Timo A.|Someth, Paradis|Lauri, Hannu|Koponen, Jorma|Sarkkula, Juha|Kummu, Matti",mekong river|hydropower|transboundary|discharge|flood pulse|hydrological modelling,10.1016/j.jhydrol.2016.12.023,JOURNAL OF HYDROLOGY,WOS:000394399100003,Observed river discharge changes due to hydropower operations in the Upper Mekong Basin,2017,https://dx.doi.org/10.1016/j.jhydrol.2016.12.023
1028,"Torresi, Elena|Casas, Monica Escola|Polesel, Fabio|Plosz, Benedek G.|Christensson, Magnus|Bester, Kai",pharmaceuticals|mbbr|carbon source|biofilms|wastewater|denitrification,10.1016/j.watres.2016.10.068,WATER RESEARCH,WOS:000390181600010,Impact of external carbon dose on the removal of micropollutants using methanol and ethanol in post-denitrifying Moving Bed Biofilm Reactors,2017,https://dx.doi.org/10.1016/j.watres.2016.10.068
1029,"McNeill, Kelsie|Macdonald, Kiera|Singh, Ashutosh|Binns, Andrew D.",global food security|water availability|climate change|hydrological models|spatial resolution,10.1016/j.agwat.2017.09.001,AGRICULTURAL WATER MANAGEMENT,WOS:000413380000010,Food and water security: Analysis of integrated modeling platforms,2017,https://dx.doi.org/10.1016/j.agwat.2017.09.001
1031,"Bakute, Anda|Grinfelde, Inga|Lagzdins, Ainis|Treija, S|Skujeniece, S",hydrological modelling|calibration|conceptual model|river basin,10.22616/rrd.23.2017.023,"RESEARCH FOR RURAL DEVELOPMENT 2017, VOL 1",WOS:000425532600021,APPLICATION OF THE MODEL METQ FOR HYDROLOGICAL CALCULATIONS,2017,https://dx.doi.org/10.22616/rrd.23.2017.023
1034,"Aaheim, Asbjorn|Wei, Taoyuan|Romstad, Bard",climate change|conflicts of interest|cge modelling|economic impacts|integrated assessment,10.1007/s11027-016-9718-8,MITIGATION AND ADAPTATION STRATEGIES FOR GLOBAL CHANGE,WOS:000413272600001,Conflicts of economic interests by limiting global warming to+3 A degrees C,2017,https://dx.doi.org/10.1007/s11027-016-9718-8
1037,"Dimitroulopoulou, C.|Ashmore, M. R.|Terry, A. C.",personal exposure|indoor air pollution|modelling|nitrogen dioxide,10.1016/j.atmosenv.2016.11.028,ATMOSPHERIC ENVIRONMENT,WOS:000392770700001,Use of population exposure frequency distributions to simulate effects of policy interventions on NO2 exposure,2017,https://dx.doi.org/10.1016/j.atmosenv.2016.11.028
1039,"Antonetti, Manuel|Scherrer, Simon|Kienzler, Peter Matthias|Margreth, Michael|Zappa, Massimiliano",dominant runoff process|hydrological modelling|regionalisation|sprinkling experiments|switzerland,10.1002/hyp.11232,HYDROLOGICAL PROCESSES,WOS:000406838200007,Process-based hydrological modelling: The potential of a bottom-up approach for runoff predictions in ungauged catchments,2017,https://dx.doi.org/10.1002/hyp.11232
1041,"Tonderski, Karin|Andersson, Lotta|Lindstrom, Goran|St Cyr, Rasmus|Schoenberg, Ronny|Taubald, Heinrich",drainage pipes|hydrological pathways|oxygen isotopes|sewage|source apportionment,10.1016/j.scitotenv.2017.06.167,SCIENCE OF THE TOTAL ENVIRONMENT,WOS:000408755300001,Assessing the use of delta O-18 in phosphate as a tracer for catchment phosphorus sources,2017,https://dx.doi.org/10.1016/j.scitotenv.2017.06.167
1043,"Lai, Y. C.|Chien, C. C.|Yang, Z. H.|Surampalli, Rao Y.|Kao, C. M.",ammonia|electric conductivity (ec)|river water quality|suspended solid (ss)|water quality index (wqi5),10.2175/106143016X14798353399584,WATER ENVIRONMENT RESEARCH,WOS:000397300200007,Developing an Integrated Modeling Tool for River Water Quality Index Assessment,2017,https://dx.doi.org/10.2175/106143016X14798353399584
1044,"Calvin, Kate|Fisher-Vanden, Karen",integrated assessment modeling|climate change|agriculture impacts,10.1088/1748-9326/aa843c,ENVIRONMENTAL RESEARCH LETTERS,WOS:000413849400003,Quantifying the indirect impacts of climate on agriculture: an inter-method comparison,2017,https://dx.doi.org/10.1088/1748-9326/aa843c
1046,"Ciullo, Alessio|Viglione, Alberto|Castellarin, Attilio|Crisci, Massimiliano|Di Baldassarre, Giuliano",flood risk|socio-hydrology|resilience|city of rome|people's republic of bangladesh,10.1080/02626667.2016.1273527,HYDROLOGICAL SCIENCES JOURNAL-JOURNAL DES SCIENCES HYDROLOGIQUES,WOS:000399556800002,Socio-hydrological modelling of flood-risk dynamics: comparing the resilience of green and technological systems,2017,https://dx.doi.org/10.1080/02626667.2016.1273527
1047,"Kraan, Oscar|Kramer, Gert Jan|van der Lei, Telli|Huppes, Gjalt|Jager, W|Verbrugge, R|Flache, A|DeRoo, G|Hoogduin, L|Hemelrijk, C",integrated assessment modelling|agent based modelling|cost-benefit analysis|mitigation|adaptation|climate change,10.1007/978-3-319-47253-9_18,ADVANCES IN SOCIAL SIMULATION 2015,WOS:000418582900018,Modelling the Energy Transition: Towards an Application of Agent Based Modelling to Integrated Assessment Modelling,2017,https://dx.doi.org/10.1007/978-3-319-47253-9_18
1049,"Rapacciuolo, G.|Ball-Damerow, J. E.|Zeilinger, A. R.|Resh, V. H.",bayesian occupancy models|population change|natural history collections|citizen science|detection bias|dragonflies|traits|temperature|nimble,10.1007/s10531-017-1399-4,BIODIVERSITY AND CONSERVATION,WOS:000412437200010,Detecting long-term occupancy changes in Californian odonates from natural history and citizen science records,2017,https://dx.doi.org/10.1007/s10531-017-1399-4
1050,"Correa, Sly Wongchuig|Dias de Paiva, Rodrigo Cauduro|Espinoza, Jhan Carlo|Collischonn, Walter",hydrological retrospective|climate reanalysis|hydrological modeling|droughts|floods|amazon basin,10.1016/j.jhydrol.2017.04.019,JOURNAL OF HYDROLOGY,WOS:000403855500052,Multi-decadal Hydrological Retrospective: Case study of Amazon floods and droughts,2017,https://dx.doi.org/10.1016/j.jhydrol.2017.04.019
1052,"Song, Jung-Hun|Her, Younggu|Park, Jihoon|Lee, Kyung-Do|Kang, Moon-Seong",simulink|tank model|rainfall-runoff modeling|modeling dynamic systems|modeling framework,10.3390/w9090639,WATER,WOS:000411567200013,Simulink Implementation of a Hydrologic Model: A Tank Model Case Study,2017,https://dx.doi.org/10.3390/w9090639
1103,"Ledesma, Jose L. J.|Futter, Martyn N.",catchment science|e-obs|hydrological modelling|model error|model input data|model uncertainty|precipitation measurement|temperature measurement,10.1002/hyp.11269,HYDROLOGICAL PROCESSES,WOS:000408341400011,Gridded climate data products are an alternative to instrumental measurements as inputs to rainfall-runoff models,2017,https://dx.doi.org/10.1002/hyp.11269
1104,"Anagnostou, Eleni|Gianni, Areti|Zacharias, Ierotheos",ecological modeling|eutrophication|nutrients cycle|oxygen depletion|three-dimensional modeling,10.1111/nrm.12130,NATURAL RESOURCE MODELING,WOS:000407149600002,Ecological modeling and eutrophicationA review,2017,https://dx.doi.org/10.1111/nrm.12130
1105,"Robinson, Craig D.|Webster, Lynda|Martinez-Gomez, Concepcion|Burgeot, Thierry|Gubbins, Matthew J.|Thain, John E.|Vethaak, A. Dick|McIntosh, Alistair D.|Hylland, Ketil",integrated assessment|ices|north atlantic|north sea|baltic sea|mediterranean sea|polycyclic aromatic hydrocarbons (pahs)|polychlorinated biphenyls (pcbs)|trace metals|environmental monitoring,10.1016/j.marenvres.2016.04.005,MARINE ENVIRONMENTAL RESEARCH,WOS:000392678200004,"Assessment of contaminant concentrations in sediments, fish and mussels sampled from the North Atlantic and European regional seas within the ICON project",2017,https://dx.doi.org/10.1016/j.marenvres.2016.04.005
1106,"Manrique de Lara, David Romero|Corral, Serafin",artisanal fishing|local knowledge|participatory planning|small islands,10.1016/j.ocecoaman.2017.03.031,OCEAN & COASTAL MANAGEMENT,WOS:000401390600014,Local community-based approach for sustainable management of artisanal fisheries on small islands,2017,https://dx.doi.org/10.1016/j.ocecoaman.2017.03.031
1174,"Bell, Joanna",,10.1093/jel/eqx013,JOURNAL OF ENVIRONMENTAL LAW,WOS:000405515700006,ClientEarth ( No 2): A Case of Three Legal Dimensions,2017,https://dx.doi.org/10.1093/jel/eqx013
1176,"Rodriguez-Huerta, Edgar|Rosas-Casals, Marti|Sorman, Alevgul H.",musiasem|energy transitions|energy planning|catalonia,10.1016/j.enpol.2017.06.024,ENERGY POLICY,WOS:000406725800051,A societal metabolism approach to job creation and renewable energy transitions in Catalonia,2017,https://dx.doi.org/10.1016/j.enpol.2017.06.024
1177,"Yang, Ang|Dutta, Dushmanta|Vaze, Jai|Kim, Shaun|Podger, Geoff",river basin management|river system modelling|agent-based modelling|ewater source|murray-darling basin,10.1080/15715124.2017.1315814,INTERNATIONAL JOURNAL OF RIVER BASIN MANAGEMENT,WOS:000423964400012,"An integrated modelling framework for building a daily river system model for the Murray-Darling Basin, Australia",2017,https://dx.doi.org/10.1080/15715124.2017.1315814
1181,"Sallam, Mohamed F.|Fizer, Chelsea|Pilant, Andrew N.|Whung, Pai-Yei",aedes|dengue|ecological modeling|physical systems|zika,10.3390/ijerph14101230,INTERNATIONAL JOURNAL OF ENVIRONMENTAL RESEARCH AND PUBLIC HEALTH,WOS:000414763200139,"Systematic Review: Land Cover, Meteorological, and Socioeconomic Determinants of Aedes Mosquito Habitat for Risk Mapping",2017,https://dx.doi.org/10.3390/ijerph14101230
1182,"Obryk, M. K.|Doran, P. T.|Waddington, E. D.|Mckay, C. P.",degree days above freezing|hydrological modelling|lgm,10.1017/S0954102017000062,ANTARCTIC SCIENCE,WOS:000412678800008,"The influence of fohn winds on Glacial Lake Washburn and palaeotemperatures in the McMurdo Dry Valleys, Antarctica, during the Last Glacial Maximum",2017,https://dx.doi.org/10.1017/S0954102017000062
1184,"van Vuuren, Detlef P.|Stehfest, Elke|Gernaat, David E. H. J.|Doelman, Jonathan C.|Van den Berg, Maarten|Harmsen, Mathijs|de Boer, Harmen Sytze|Bouwman, Lex F.|Daioglou, Vassilis|Edelenbosch, Oreane Y.|Girod, Bastien|Kram, Tom|Lassaletta, Luis|Lucas, Paul L.|van Meijl, Hans|Mueller, Christoph|van Ruijven, Bas J.|van der Sluis, Sietske|Tabeau, Andrzej",shared socio-economic pathways (ssps)|sustainable development|integrated assessment|climate change research|scenarios,10.1016/j.gloenvcha.2016.05.008,GLOBAL ENVIRONMENTAL CHANGE-HUMAN AND POLICY DIMENSIONS,WOS:000394634500022,"Energy, land-use and greenhouse gas emissions trajectories under a green growth paradigm",2017,https://dx.doi.org/10.1016/j.gloenvcha.2016.05.008
1191,"Makwana, Jaydip J.|Tiwari, Mukesh K.",hydrological modelling|surface runoff|remote sensing and gis|swat|neural networks,10.1007/s40808-017-0323-y,MODELING EARTH SYSTEMS AND ENVIRONMENT,WOS:000432244700011,"Hydrological stream flow modelling using soil and water assessment tool (SWAT) and neural networks (NNs) for the Limkheda watershed, Gujarat, India",2017,https://dx.doi.org/10.1007/s40808-017-0323-y
1195,"Gelleszun, Marlene|Kreye, Phillip|Meon, Guenter",hydrological modelling|calibration|lexicographic approach|optimisation|sensitivity analysis,10.1016/j.jhydrol.2017.08.015,JOURNAL OF HYDROLOGY,WOS:000412612700055,Representative parameter estimation for hydrological models using a lexicographic calibration strategy,2017,https://dx.doi.org/10.1016/j.jhydrol.2017.08.015
1196,"Liu, L.|Li, R.|Wang, Y. Z.",water cycle|distributed hydrological model|downscaling|flood|water resources|extreme events,10.15666/aeer/1503_10251040,APPLIED ECOLOGY AND ENVIRONMENTAL RESEARCH,WOS:000403811200075,"EVALUATION OF CLIMATE CHANGE IMPACTS ON HYDROLOGICAL PROCESSES IN THE YANGTZE RIVER DELTA REGION, CHINA",2017,https://dx.doi.org/10.15666/aeer/1503_10251040
1198,"Gloege, Lucas|McKinley, Galen A.|Mouw, Colleen B.|Ciochetto, Audrey B.",,10.1002/2016GB005535,GLOBAL BIOGEOCHEMICAL CYCLES,WOS:000407369600010,Global evaluation of particulate organic carbon flux parameterizations and implications for atmospheric pCO(2),2017,https://dx.doi.org/10.1002/2016GB005535
1200,"Piniewski, M.|Szczesniak, M.|Kardel, I.|Berezowski, T.|Okruszko, T.|Srinivasan, R.|Schuler, D. Vikhamar|Kundzewicz, Z. W.",regionalization|blue water|green water|spatial calibration|hydrological modelling|open source data,10.1080/02626667.2017.1321842,HYDROLOGICAL SCIENCES JOURNAL-JOURNAL DES SCIENCES HYDROLOGIQUES,WOS:000403800000007,Hydrological modelling of the Vistula and Odra river basins using SWAT,2017,https://dx.doi.org/10.1080/02626667.2017.1321842
1201,"Stan, Constantin|Apostol, Tiberiu|Streche, Constantin",energy resources|power generation|waste management|waste recovery,,2017 8TH INTERNATIONAL CONFERENCE ON ENERGY AND ENVIRONMENT (CIEM),WOS:000427610300024,An Integrated Assessment of Energy Recovery Options from Municipal Solid Waste,2017,https://dx.doi.org/
1203,"Khaki, M.|Ait-El-Fquih, B.|Hoteit, I.|Forootan, E.|Awange, J.|Kuhn, M.",constrained data assimilation|ensemble kalman filtering|weak constrained ensemble kalman filter|water budget closure|hydrological modelling,10.1016/j.jhydrol.2017.10.032,JOURNAL OF HYDROLOGY,WOS:000418107600036,A two-update ensemble Kalman filter for land hydrological data assimilation with an uncertain constraint,2017,https://dx.doi.org/10.1016/j.jhydrol.2017.10.032
1208,"Shuler, Christopher K.|El-Kadi, Aly I.|Dulai, Henrietta|Glenn, Craig R.|Fackrell, Joseph",hydrochemical modeling|groundwater management|nstable isotopes|non-point source pollution|american samoa (usa),10.1007/s10040-017-1617-x,HYDROGEOLOGY JOURNAL,WOS:000415195900015,"Source partitioning of anthropogenic groundwater nitrogen in a mixed-use landscape, Tutuila, American Samoa",2017,https://dx.doi.org/10.1007/s10040-017-1617-x
1209,"Geelen, L. H. W. T.|Kamps, P. T. W. J.|Olsthoorn, T. N.",dune slack restoration|watersupply amsterdam|coastal dunes|eco-hydrology,10.1007/s11852-016-0452-x,JOURNAL OF COASTAL CONSERVATION,WOS:000414166600008,"From overexploitation to sustainable use, an overview of 160 years of water extraction in the Amsterdam dunes, the Netherlands",2017,https://dx.doi.org/10.1007/s11852-016-0452-x
1211,"Chen, Jie|Brissette, Francois P.|Liu, Pan|Xia, Jun",bias correction method|climate change impacts|hydrological modelling|regional climate model,10.1002/hyp.11368,HYDROLOGICAL PROCESSES,WOS:000416149500011,Using raw regional climate model outputs for quantifying climate change impacts on hydrology,2017,https://dx.doi.org/10.1002/hyp.11368
1213,"Cuceloglu, Gokhan|Abbaspour, Karim C.|Ozturk, Izzet",hydrological modeling|swat|swat-cup|water-resources modeling|water availability|water potential|istanbul,10.3390/w9100814,WATER,WOS:000414707500089,Assessing the Water-Resources Potential of Istanbul by Using a Soil and Water Assessment Tool (SWAT) Hydrological Model,2017,https://dx.doi.org/10.3390/w9100814
1216,"Du, Erhu|Rivera, Samuel|Cai, Ximing|Myers, Laura|Ernest, Andrew|Minsker, Barbara",agent-based modeling|behavioral heterogeneity|decision support systems|evacuation|flood warning|flooding|simulation,10.1111/1752-1688.12475,JOURNAL OF THE AMERICAN WATER RESOURCES ASSOCIATION,WOS:000400598400006,IMPACTS OF HUMAN BEHAVIORAL HETEROGENEITY ON THE BENEFITS OF PROBABILISTIC FLOOD WARNINGS: AN AGENT-BASED MODELING FRAMEWORK,2017,https://dx.doi.org/10.1111/1752-1688.12475
1218,"Pienaar, G. W.|Hughes, D. A.",uncertainty|environmental modelling|water allocations|supply deficit impacts|decision making,10.1007/s11269-016-1523-3,WATER RESOURCES MANAGEMENT,WOS:000393777100018,Linking Hydrological Uncertainty with Equitable Allocation for Water Resources Decision-Making,2017,https://dx.doi.org/10.1007/s11269-016-1523-3
