635,"Ockenden, M. C.|Deasy, C. E.|Benskin, C. McW. H.|Beven, K. J.|Burke, S.|Collins, A. L.|Evans, R.|Falloon, P. D.|Forber, K. J.|Hiscock, K. M.|Hollaway, M. J.|Kahana, R.|Macleod, C. J. A.|Reaney, S. M.|Snell, M. A.|Villamizar, M. L.|Wearing, C.|Withers, P. J. A.|Zhou, J. G.|Haygarth, P. M.",rainfall|diffuse pollution|water quality|phosphorus|high resolution data|eden,10.1016/j.scitotenv.2015.12.086,SCIENCE OF THE TOTAL ENVIRONMENT,WOS:000370246000034,Changing climate and nutrient transfers: Evidence from high temporal resolution concentration-flow dynamics in headwater catchments,2016,https://dx.doi.org/10.1016/j.scitotenv.2015.12.086
415,"Cheng, Guanhui|Dong, Cong|Huang, Guohe|Baetz, Brian W.|Han, Jingcheng",hydrometeorology|nonlinearity analysis|uncertainty assessment|interaction analysis|hydrological modelling,10.1002/hyp.10909,HYDROLOGICAL PROCESSES,WOS:000388302900003,"Discrete principal-monotonicity inference for hydro-system analysis under irregular nonlinearities, data uncertainties, and multivariate dependencies. Part I: methodology development",2016,https://dx.doi.org/10.1002/hyp.10909
638,"Wang, Mei|Zhang, Chao|Zhang, Zhuo|Li, Fasheng|Guo, Guanlin",lead-acid battery site|bioavailability|health risk|blood lead|probability density,10.1016/j.ecoenv.2016.02.017,ECOTOXICOLOGY AND ENVIRONMENTAL SAFETY,WOS:000373660700016,Distribution and integrated assessment of lead in an abandoned lead-acid battery site in Southwest China before redevelopment,2016,https://dx.doi.org/10.1016/j.ecoenv.2016.02.017
640,"Farzaneh, Hooman|Doll, Christopher N. H.|Puppim de Oliveira, Jose A.",urban energy system|optimization modeling|cost-effective|electricity deficiency|co-benefits|delhi,10.1016/j.jclepro.2015.05.098,JOURNAL OF CLEANER PRODUCTION,WOS:000384626400026,An integrated supply-demand model for the optimization of energy flow in the urban system,2016,https://dx.doi.org/10.1016/j.jclepro.2015.05.098
641,"Zidon, Royi|Tsueda, Hirotsugu|Morin, Efrat|Morin, Shai",bemisia tabaci|climate change|degree-day model|downscaling|general circulation models|intra-annual temperature variability|invasive species|population dynamics models|reproductive performance|weather generator,10.1890/15-1045,ECOLOGICAL APPLICATIONS,WOS:000378092900018,Projecting pest population dynamics under global warming: the combined effect of inter- and intra-annual variations,2016,https://dx.doi.org/10.1890/15-1045
642,"Golmohammadi, Golmar|Rudra, Ramesh P.|Prasher, Shiv O.|Madani, Ali|Goel, Pradeep K.|Mohammadi, Kourosh",hydrological modeling|drainmod|nitrogen|subsurface drainage|water table depth|climate change,10.1016/j.compag.2016.03.031,COMPUTERS AND ELECTRONICS IN AGRICULTURE,WOS:000377319800009,"Modeling the impacts of tillage practices on water table depth, drain outflow and nitrogen losses using DRAINMOD",2016,https://dx.doi.org/10.1016/j.compag.2016.03.031
643,"Yue, Dajun|Pandya, Shyama|You, Fengqi",,10.1021/acs.est.5b04279,ENVIRONMENTAL SCIENCE & TECHNOLOGY,WOS:000369471300049,Integrating Hybrid Life Cycle Assessment with Multiobjective Optimization: A Modeling Framework,2016,https://dx.doi.org/10.1021/acs.est.5b04279
644,"Pianosi, Francesca|Beven, Keith|Freer, Jim|Hall, Jim W.|Rougier, Jonathan|Stephenson, David B.|Wagener, Thorsten",sensitivity analysis|uncertainty analysis|calibration|evaluation|robust decision-making,10.1016/j.envsoft.2016.02.008,ENVIRONMENTAL MODELLING & SOFTWARE,WOS:000374602000016,Sensitivity analysis of environmental models: A systematic review with practical workflow,2016,https://dx.doi.org/10.1016/j.envsoft.2016.02.008
647,"Serang, Sarfaraz|Grimm, Kevin J.|McArdle, John J.",growth mixture model|longitudinal|mixed-effects model|nonlinear,10.1080/10705511.2016.1197777,STRUCTURAL EQUATION MODELING-A MULTIDISCIPLINARY JOURNAL,WOS:000386331300007,Estimation of Time-Unstructured Nonlinear Mixed-Effects Mixture Models,2016,https://dx.doi.org/10.1080/10705511.2016.1197777
664,"Hess, Tim|Daccache, Andre|Daneshkhah, Ali|Knox, Jerry",water resources|catchment|regionalisation|england and wales|penman-monteith,10.1080/02626667.2015.1083105,HYDROLOGICAL SCIENCES JOURNAL-JOURNAL DES SCIENCES HYDROLOGIQUES,WOS:000373781900012,Scale impacts on spatial variability in reference evapotranspiration,2016,https://dx.doi.org/10.1080/02626667.2015.1083105
649,"Bravo de la Parra, R.|Marva, M.|Sansegundo, F.",structured population|discrete model|dispersal|time scales,10.1051/mmnp/201611409,MATHEMATICAL MODELLING OF NATURAL PHENOMENA,WOS:000380620500009,Fast Dispersal in Semelparous Populations,2016,https://dx.doi.org/10.1051/mmnp/201611409
650,"Gengler, Sarah|Bogaert, Patrick",drainage classes|bayesian data fusion|categorical data|spatial estimation,10.1007/s11004-015-9585-y,MATHEMATICAL GEOSCIENCES,WOS:000368729600006,Bayesian Data Fusion Applied to Soil Drainage Classes Spatial Mapping,2016,https://dx.doi.org/10.1007/s11004-015-9585-y
652,"Refsgaard, J. C.|Hojberg, A. L.|He, X.|Hansen, A. L.|Rasmussen, S. H.|Stisen, S.",distributed hydrological model|minimum scale of predictive capability|representative elementary scale (res),10.1002/hyp.11029,HYDROLOGICAL PROCESSES,WOS:000392866700005,Where are the limits of model predictive capabilities?,2016,https://dx.doi.org/10.1002/hyp.11029
410,"Fabre, Julie|Ruelland, Denis|Dezetter, Alain|Grouillet, Benjamin",,10.5194/hess-20-3129-2016,HYDROLOGY AND EARTH SYSTEM SCIENCES,WOS:000382835700003,Sustainability of water uses in managed hydrosystems: human- and climate-induced changes for the mid-21st century,2016,https://dx.doi.org/10.5194/hess-20-3129-2016
656,"Liu, Yan|Jeong, Han Koo|Collette, Matthew",surrogate model|optimization|interval uncertainty|reliability|composite structures,10.1016/j.compstruc.2016.08.004,COMPUTERS & STRUCTURES,WOS:000386989300001,Efficient optimization of reliability-constrained structural design problems including interval uncertainty,2016,https://dx.doi.org/10.1016/j.compstruc.2016.08.004
407,"Abomhara, Mohamed|Ben Lazrag, Mehdi",,,"2016 IEEE 18TH INTERNATIONAL CONFERENCE ON E-HEALTH NETWORKING, APPLICATIONS AND SERVICES (HEALTHCOM)",WOS:000391459700044,UML/OCL-based Modeling of Work-Based Access Control Policies for Collaborative Healthcare Systems,2016,https://dx.doi.org/
658,"Ngoc Duong Vo, |Gourbesville, Philippe",deterministic hydrological modeling|long-term simulations|multi-calibration|sensitivity analysis|vietnam|vu gia thu bon catchment,10.2166/hydro.2016.138,JOURNAL OF HYDROINFORMATICS,WOS:000383770600009,"Application of deterministic distributed hydrological model for large catchment: a case study at Vu Gia Thu Bon catchment, Vietnam",2016,https://dx.doi.org/10.2166/hydro.2016.138
660,"Nieuwlaar, Evert|Roes, Alexander L.|Patel, Martin K.",ecological modeling|energy analysis|fuel efficiency|industrial ecology|industrial energy use|life cycle assessment (lca),10.1111/jiec.12300,JOURNAL OF INDUSTRIAL ECOLOGY,WOS:000383371000015,Final Energy Requirements of Steam for Use in Environmental Life Cycle Assessment,2016,https://dx.doi.org/10.1111/jiec.12300
404,"Hingerl, Luitpold|Kunstmann, Harald|Wagner, Sven|Mauder, Matthias|Bliefernicht, Jan|Rigon, Riccardo",water and energy flux analysis|eddy covariance measurements|geotop|terrestrial environmental observatories (tereno),10.1002/hyp.10893,HYDROLOGICAL PROCESSES,WOS:000385434400005,Spatio-temporal variability of water and energy fluxes - a case study for a mesoscale catchment in pre-alpine environment,2016,https://dx.doi.org/10.1002/hyp.10893
663,"Rodriguez-Rodriguez, D.|Martinez-Vega, J.",protected area|effectiveness|assessment system|network manager|scientist|siapa,10.1016/j.ecolind.2016.01.011,ECOLOGICAL INDICATORS,WOS:000371098700030,What should be evaluated from a manager's perspective? Developing a salient protected area effectiveness evaluation system for managers and scientists in Spain,2016,https://dx.doi.org/10.1016/j.ecolind.2016.01.011
389,"Whateley, Sarah|Steinschneider, Scott|Brown, Casey",water management|climate change|monte carlo simulation|sequent peak algorithm,10.1061/(ASCE)WR.1943-5452.0000631,JOURNAL OF WATER RESOURCES PLANNING AND MANAGEMENT,WOS:000376441100003,Selecting Stochastic Climate Realizations to Efficiently Explore a Wide Range of Climate Risk to Water Resource Systems,2016,https://dx.doi.org/10.1061/(ASCE)WR.1943-5452.0000631
701,"Semakula, Henry Musoke|Song, Guobao|Achuu, Simon Peter|Zhang, Shushen",malaria parasitaemia|bayesian belief network|household factors|children|sub-saharan africa,10.1016/j.envsoft.2015.10.006,ENVIRONMENTAL MODELLING & SOFTWARE,WOS:000367105900005,A Bayesian belief network modelling of household factors influencing the risk of malaria: A study of parasitaemia in children under five years of age in sub-Saharan Africa,2016,https://dx.doi.org/10.1016/j.envsoft.2015.10.006
702,"Dmitriev, Vasiliy|Kaledin, Vladimir|Kaledin, Nikolai",geoecological assessment|geosystems|indicator approach|integral indicators,,"ECOLOGY, ECONOMICS, EDUCATION AND LEGISLATION CONFERENCE PROCEEDINGS, SGEM 2016, VOL II",WOS:000391519600113,THEORY AND PRACTICE OF INTEGRATED ASSESSMENT OF THE STATE OF COMPLEX SYSTEMS IN NATURE AND SOCIETY,2016,https://dx.doi.org/
752,"Launiainen, Samuli|Katul, Gabriel G.|Kolari, Pasi|Lindroth, Anders|Lohila, Annalea|Aurela, Mika|Varlagin, Andrej|Grelle, Achim|Vesala, Timo",boreal forest|ecosystem modeling|eddy-covariance|energy budget|evapotranspiration|latent and sensible heat flux|leaf area index|light-use efficiency|remote sensing|water-use efficiency,10.1111/gcb.13497,GLOBAL CHANGE BIOLOGY,WOS:000387813300022,Do the energy fluxes and surface conductance of boreal coniferous forests in Europe scale with leaf area?,2016,https://dx.doi.org/10.1111/gcb.13497
739,"Varga, M.|Balogh, S.|Csukas, B.",gis based process modelling|network based expert interface|generic model interpreter|extensible process model|generic user interface|watershed,10.1016/j.envsoft.2015.10.022,ENVIRONMENTAL MODELLING & SOFTWARE,WOS:000367105900020,"An extensible, generic environmental process modelling framework with an example for a watershed of a shallow lake",2016,https://dx.doi.org/10.1016/j.envsoft.2015.10.022
740,"Hartmann, Andreas",,10.1002/wat2.1146,WILEY INTERDISCIPLINARY REVIEWS-WATER,WOS:000382874800001,Putting the cat in the box: why our models should consider subsurface heterogeneity at all scales,2016,https://dx.doi.org/10.1002/wat2.1146
741,"Kundu, Partha|Kumar, Vimal|Hoarau, Yannick|Mishra, Indra Mani",computational fluid dynamics|large eddy simulation|modeling and simulation|porous medium|rans|turbulent flow,10.1016/j.apm.2016.06.043,APPLIED MATHEMATICAL MODELLING,WOS:000393539100013,Numerical simulation and analysis of fluid flow hydrodynamics through a structured array of circular cylinders forming porous medium,2016,https://dx.doi.org/10.1016/j.apm.2016.06.043
742,"Liu, F. F.|Li, Y. P.|Huang, G. H.|Cui, L.|Liu, J.",factorial analysis|fuzzy vertex|hydrological possesses|sensitivity analysis|topography-based hydrological model (topmodel)|uncertainty,10.1061/(ASCE)HE.1943-5584.0001337,JOURNAL OF HYDROLOGIC ENGINEERING,WOS:000372804000009,Assessing Uncertainty in Hydrological Processes Using a Fuzzy Vertex Simulation Method,2016,https://dx.doi.org/10.1061/(ASCE)HE.1943-5584.0001337
744,"Costa, Diogo|Burlando, Paolo|Liong, Shie-Yui",river-groundwater systems|fully coupled models|contaminant transport|water quality|river reach and corridor scales,10.1016/j.envsoft.2016.09.009,ENVIRONMENTAL MODELLING & SOFTWARE,WOS:000388779600008,Coupling spatially distributed river and groundwater transport models to investigate contaminant dynamics at river corridor scales,2016,https://dx.doi.org/10.1016/j.envsoft.2016.09.009
745,"Viglione, Alberto|Merz, Bruno|Nguyen Viet Dung, |Parajka, Juraj|Nester, Thomas|Bloeschl, Gunter",,10.1002/2016WR019036,WATER RESOURCES RESEARCH,WOS:000383683800022,Attribution of regional flood changes based on scaling fingerprints,2016,https://dx.doi.org/10.1002/2016WR019036
747,"Lari, Kaveh Sookhak|Davis, Greg B.|Johnston, Colin D.",multi-phase|multi-component|hysteresis|simulation|gasoline,10.1016/j.advwatres.2016.07.012,ADVANCES IN WATER RESOURCES,WOS:000384958100017,Incorporating hysteresis in a multi-phase multi-component NAPL modelling framework; a multi-component LNAPL gasoline example,2016,https://dx.doi.org/10.1016/j.advwatres.2016.07.012
368,"Mellor, Jonathan E.|Levy, Karen|Zimmerman, Julie|Elliott, Mark|Bartram, Jamie|Carlton, Elizabeth|Clasen, Thomas|Dillingham, Rebecca|Eisenberg, Joseph|Guerrant, Richard|Lantagne, Daniele|Mihelcic, James|Nelson, Kara",climate change|water|health|diarrhea|complex systems|coupled systems,10.1016/j.scitotenv.2015.12.087,SCIENCE OF THE TOTAL ENVIRONMENT,WOS:000370246000010,Planning for climate change: The need for mechanistic systems-based approaches to study climate change impacts on diarrheal diseases,2016,https://dx.doi.org/10.1016/j.scitotenv.2015.12.087
367,"Leung, Juliana Y.|Srinivasan, Sanjay",effective mass transfer coefficient|scaling methods|volume averaging|fractals|geostatistics,10.1016/j.jconhyd.2016.07.007,JOURNAL OF CONTAMINANT HYDROLOGY,WOS:000383299400015,Effects of reservoir heterogeneity on scaling of effective mass transfer coefficient for solute transport,2016,https://dx.doi.org/10.1016/j.jconhyd.2016.07.007
366,"Rasmussen, Jorn|Madsen, Henrik|Jensen, Karsten Hogh|Refsgaard, Jens Christian",,10.5194/hess-20-2103-2016,HYDROLOGY AND EARTH SYSTEM SCIENCES,WOS:000377862900027,Data assimilation in integrated hydrological modelling in the presence of observation bias,2016,https://dx.doi.org/10.5194/hess-20-2103-2016
754,"Langheinrich, Uta|Luederitz, Volker",,,WASSERWIRTSCHAFT,WOS:000371370600003,Assessment of the Ecological Status of Ditches - a Comparison of Approaches,2016,https://dx.doi.org/
1,"Kandiah, Venu K.|Berglund, Emily Z.|Binder, Andrew R.",complex adaptive system|diffusion of innovation|dual water system|sociotechnical transition|urban water management|water reuse,10.1061/(ASCE)WR.1943-5452.0000696,JOURNAL OF WATER RESOURCES PLANNING AND MANAGEMENT,WOS:000388223600003,Cellular Automata Modeling Framework for Urban Water Reuse Planning and Management,2016,https://dx.doi.org/10.1061/(ASCE)WR.1943-5452.0000696
363,"Vokoun, Martin|Hanel, Martin",validation|nwp|hydroprognosis|aladin,,"WATER, RESOURCES, FOREST, MARINE AND OCEAN ECOSYSTEMS CONFERENCE PROCEEDINGS, VOL I",WOS:000391653400106,VERIFICATION OF ENSEMBLE PRECIPITATION FORECASTS FOR HYDROLOGICAL MODELLING IN THE CZECH REPUBLIC,2016,https://dx.doi.org/
756,"Aijo, Tarmo|Yue, Xiaojing|Rao, Anjana|Lahdesmaki, Harri",,10.1093/bioinformatics/btw468,BIOINFORMATICS,WOS:000384666800016,LuxGLM: a probabilistic covariate model for quantification of DNA methylation modifications with complex experimental designs,2016,https://dx.doi.org/10.1093/bioinformatics/btw468
760,"Daggupati, Prasad|Deb, Debjani|Srinivasan, Raghavan|Yeganantham, Dhanesh|Mehta, Vikram M.|Rosenberg, Norman J.",large-scale modeling|regionalization|calibration and validation|swat|fine-resolution modeling|crop and water yields,10.1111/1752-1688.12413,JOURNAL OF THE AMERICAN WATER RESOURCES ASSOCIATION,WOS:000385007100007,LARGE-SCALE FINE-RESOLUTION HYDROLOGICAL MODELING USING PARAMETER REGIONALIZATION IN THE MISSOURI RIVER BASIN,2016,https://dx.doi.org/10.1111/1752-1688.12413
762,"Moyer, Alexis N.|Moore, R. D.|Koppes, Michele N.",lake-calving glacier|hydrological modelling|trend analysis|glacier hydrology|glacier retreat|peak water,10.1002/hyp.10890,HYDROLOGICAL PROCESSES,WOS:000384773400009,Streamflow response to the rapid retreat of a lake-calving glacier,2016,https://dx.doi.org/10.1002/hyp.10890
358,"Jelin, Benjamin A.|Sun, Wenjie|Kravets, Alexandra|Naboka, Maryna|Stepanova, Eugenia I.|Vdovenko, Vitally Y.|Karmauss, Wilfried J.|Lichosherstov, Alex|Svendsen, Erik R.",epidemiology|exposure modeling|environmental modeling|dietary exposure|child exposure|(137)cesium,10.1038/jes.2015.6,JOURNAL OF EXPOSURE SCIENCE AND ENVIRONMENTAL EPIDEMIOLOGY,WOS:000386539500003,Quantifying annual internal effective (137)Cesium dose utilizing direct body-burden measurement and ecological dose modeling,2016,https://dx.doi.org/10.1038/jes.2015.6
357,"Romero, Estela|Le Gendre, Romain|Garnier, Josette|Billen, Gilles|Fisson, Cedric|Silvestre, Marie|Riou, Philippe",seine river|water quality|nutrients|long-term trends|wfd|policy,10.1016/j.envsci.2016.01.016,ENVIRONMENTAL SCIENCE & POLICY,WOS:000370900400015,Long-term water quality in the lower Seine: Lessons learned over 4 decades of monitoring,2016,https://dx.doi.org/10.1016/j.envsci.2016.01.016
765,"Dumitrache, Rodica Claudia|Iriza, Amalia|Maco, Bogdan Alexandru|Barbu, Cosmin Danut|Hirtl, Marcus|Mantovani, Simone|Nicola, Oana|Irimescu, Anisoara|Craciunescu, Vasile|Ristea, Alina|Diamandi, Andrei",air quality modeling|wrf-chem|pm10|ground and satellite data assimilation,10.1016/j.atmosenv.2016.08.063,ATMOSPHERIC ENVIRONMENT,WOS:000383932400026,Study on the influence of ground and satellite observations on the numerical air-quality for PM10 over Romanian territory,2016,https://dx.doi.org/10.1016/j.atmosenv.2016.08.063
766,"Lobanova, Anastasia|Koch, Hagen|Liersch, Stefan|Hattermann, Fred F.|Krysanova, Valentina",tagus|hydrological modelling|swim|reservoirs|hydropower|climate change,10.1002/hyp.10966,HYDROLOGICAL PROCESSES,WOS:000392866700012,Impacts of changing climate on the hydrology and hydropower production of the Tagus River basin,2016,https://dx.doi.org/10.1002/hyp.10966
767,"Wu, Huijuan|Leong, Ching",indicators and indices|integrated assessment|iwrm|river basin|sustainability,10.2166/wp.2016.109,WATER POLICY,WOS:000391298000009,"A composite framework of river sustainability: integration across time, space and interests in the Yellow River and Ganges River",2016,https://dx.doi.org/10.2166/wp.2016.109
768,"Agathokleous, Agathoklis|Christodoulou, Symeon|Kyriakides, E|Kyriacou, E|Ellinas, G|Louca, S|Mavromoustakis, C|Michael, D|Vassiliou, |Hadjichristofi, G|Georgiou, J|Panayiotou, C|Paschalidou, A|Loizou, C|Pattichis, CS",water distribution networks|intermittent water supply|survival analysis|environmental modeling and data analysis,,PROCEEDINGS OF THE 18TH MEDITERRANEAN ELECTROTECHNICAL CONFERENCE MELECON 2016,WOS:000390719500169,Modeling and Analysis of Urban Water Distribution Networks During Intermittent Water Supply Periods,2016,https://dx.doi.org/
738,"Zhu, Dehua|Echendu, Shirley|Xuan, Yunqing|Webster, Mike|Cluckie, Ian",,10.5194/hess-20-4707-2016,HYDROLOGY AND EARTH SYSTEM SCIENCES,WOS:000388723800001,Coupled hydro-meteorological modelling on a HPC platform for high-resolution extreme weather impact study,2016,https://dx.doi.org/10.5194/hess-20-4707-2016
736,"Chadalawada, Jayashree|Havlicek, Vojtech|Babovic, Vladan|Kim, JH|Kim, HS|Yoo, DG|Jung, D|Song, CG",genetic programming|multi-objective optimization|system identification|data driven modelling in hydrology|urban rainfall-runoff modelling,10.1016/j.proeng.2016.07.601,12TH INTERNATIONAL CONFERENCE ON HYDROINFORMATICS (HIC 2016) - SMART WATER FOR THE FUTURE,WOS:000385793200147,Genetic Programming based Approach towards Understanding the Dynamics of Urban Rainfall-Runoff Process,2016,https://dx.doi.org/10.1016/j.proeng.2016.07.601
704,"Berestneva, Olga|Zharkova, Oxana|Pekker, Yakov|Marukhina, Olga|Hassanin, Hatem M. A.|Sharopin, Konstantin|Berestneva, O|Tikhomirov, A|Trufanov, A",adaptive possibilities biosystems|entropy methods|integrated assessment|state of biosystems|modeling complex systems,,"PROCEEDINGS OF THE 2016 CONFERENCE ON INFORMATION TECHNOLOGIES IN SCIENCE, MANAGEMENT, SOCIAL SPHERE AND MEDICINE (ITSMSSM)",WOS:000390305500049,Entropy Methods Application For Biosystems State Analysis,2016,https://dx.doi.org/
720,"Dias, Daniela|Tchepel, Oxana|Antunes, Antonio Pais",low emission zones|traffic-related air pollution|transportation modelling|emissions modelling|air quality modelling|impact evaluation,10.1016/j.jenvman.2016.04.031,JOURNAL OF ENVIRONMENTAL MANAGEMENT,WOS:000376805300029,Integrated modelling approach for the evaluation of low emission zones,2016,https://dx.doi.org/10.1016/j.jenvman.2016.04.031
386,"Liao, Hehuan|Krometis, Leigh-Anne H.|Kline, Karen",fecal indicator bacteria|human illness risks|quantitative microbial risk assessment|total maximum daily load|waterborne diseases,10.1016/j.scitotenv.2016.02.044,SCIENCE OF THE TOTAL ENVIRONMENT,WOS:000372589800070,Coupling a continuous watershed-scale microbial fate and transport model with a stochastic dose-response model to estimate risk of illness in an urban watershed,2016,https://dx.doi.org/10.1016/j.scitotenv.2016.02.044
709,"Zijp, Michiel C.|Posthuma, Leo|Wintersen, Arjen|Devilee, Jeroen|Swartjes, Frank A.",solution-focused|sustainability|wicked problem|human health risk assessment|ecological risk assessment|sediment management,10.1016/j.envint.2016.03.006,ENVIRONMENT INTERNATIONAL,WOS:000375630500034,"Definition and use of Solution-focused Sustainability Assessment: A novel approach to generate, explore and decide on sustainable solutions for wicked problems",2016,https://dx.doi.org/10.1016/j.envint.2016.03.006
383,"Felix, Vagner de Souza|da Paz, Adriano Rolim",mgb-iph|distributed hydrologic model|rainfall-runoff modeling|intermittent river|semiarid region,10.1590/2318-0331.011616009,RBRH-REVISTA BRASILEIRA DE RECURSOS HIDRICOS,WOS:000407703400008,Hydrological processes representation in a semiarid catchment located in Paraiba state with distributed hydrological modeling,2016,https://dx.doi.org/10.1590/2318-0331.011616009
711,"Zhuo, Lu|Han, Dawei|Kim, JH|Kim, HS|Yoo, DG|Jung, D|Song, CG",soil moisture|satellite remote sensing|hydrological modelling,10.1016/j.proeng.2016.07.499,12TH INTERNATIONAL CONFERENCE ON HYDROINFORMATICS (HIC 2016) - SMART WATER FOR THE FUTURE,WOS:000385793200183,The Relevance of Soil Moisture by Remote Sensing and Hydrological Modelling,2016,https://dx.doi.org/10.1016/j.proeng.2016.07.499
712,"Zhuo, Lu|Han, Dawei|Dai, Qiang",smos brightness temperature|soil moisture|local linear regression (llr)|artificial neural networks (anns)|soil moisture deficit (smd)|hydrological modelling,10.1016/j.jhydrol.2016.05.052,JOURNAL OF HYDROLOGY,WOS:000378953700030,Soil moisture deficit estimation using satellite multi-angle brightness temperature,2016,https://dx.doi.org/10.1016/j.jhydrol.2016.05.052
713,"Zemtsov, Stepan P.|Goryachko, Mariya D.|Baburin, Vyacheslav L.|Krylenko, Inna N.|Yumina, Natalia M.",socio-economic risks|economic damage analysis|social vulnerability index|hydrological hazards|slavyansk municipal,10.1007/s11069-016-2290-4,NATURAL HAZARDS,WOS:000376431300004,Integrated assessment of socio-economic risks of hazardous hydrological phenomena in Slavyansk municipal district,2016,https://dx.doi.org/10.1007/s11069-016-2290-4
714,"Audzijonyte, Asta|Kuparinen, Anna",ecosystem modeling|fisheries-induced evolution|per capita population growth rate|recovery|size-based predation|depredacion por tamanos|evolucion inducida por las pesquerias|modelado de ecosistemas|tasa de crecimiento poblacional per capita,10.1111/cobi.12651,CONSERVATION BIOLOGY,WOS:000379947700007,The role of life histories and trophic interactions in population recovery,2016,https://dx.doi.org/10.1111/cobi.12651
380,"Ham, Jonghwa|Hong, Yoon-Seok Timothy",uncertainty analysis|integrated modelling system|river basin management measure|treatment wetland|monte carlo simulation|glue,10.1002/ird.2069,IRRIGATION AND DRAINAGE,WOS:000386949600028,Integrated Modelling System with Uncertainty Analysis for Reservoir Water Quality Management in a Reclamation River Basin,2016,https://dx.doi.org/10.1002/ird.2069
718,"Shabani, Farzin|Cacho, Oscar|Kumar, Lalit",agriculture|climate change|climex|phoenix dactylifera l|date palms|economics,10.1080/10807039.2016.1162089,HUMAN AND ECOLOGICAL RISK ASSESSMENT,WOS:000379244900011,Effects of climate change on economic feasibility of future date palm production: An integrated assessment in Iran,2016,https://dx.doi.org/10.1080/10807039.2016.1162089
719,"Veettil, Anoop Valiya|Mishra, Ashok K.",water scarcity|water vulnerability|blue water|green water|swat,10.1016/j.jhydrol.2016.09.032,JOURNAL OF HYDROLOGY,WOS:000388248400042,Water security assessment using blue and green water footprint concepts,2016,https://dx.doi.org/10.1016/j.jhydrol.2016.09.032
721,"Ali, Hafiz Munsub|Lee, Daniel C.",swarm intelligence|fireworks algorithm|similarity measure|max-sat,,2016 SIXTH INTERNATIONAL CONFERENCE ON INNOVATIVE COMPUTING TECHNOLOGY (INTECH),WOS:000405503900036,Solving the MAX-SAT Problem by Binary Enhanced Fireworks Algorithm,2016,https://dx.doi.org/
371,"MacDonald, Matthew K.|Davison, Bruce J.|Mekonnen, Muluneh A.|Pietroniro, Alain",land surface scheme|forcing|model|uncertainty|hydrology|mountains|forest|prairies,10.1080/02626667.2016.1177185,HYDROLOGICAL SCIENCES JOURNAL-JOURNAL DES SCIENCES HYDROLOGIQUES,WOS:000387163700006,Comparison of land surface scheme simulations with field observations versus atmospheric model output as forcing,2016,https://dx.doi.org/10.1080/02626667.2016.1177185
379,"Belachew, Dagnachew Legesse|Leavesley, George|David, Olaf|Patterson, Dave|Aggarwal, Pradeep|Araguas, Luis|Terzer, Stefan|Carlson, Jack",groundwater|hydrogen-2|isotope ecology|isotope hydrological modeling|lake victoria|nile river|oxygen-18,10.1080/10256016.2015.1113959,ISOTOPES IN ENVIRONMENTAL AND HEALTH STUDIES,WOS:000383923800011,"IAEA Isotope-enabled coupled catchment-lake water balance model, IWBMIso: description and validation",2016,https://dx.doi.org/10.1080/10256016.2015.1113959
378,"Dahri, Zakir Hussain|Ludwig, Fulco|Moors, Eddy|Ahmad, Bashir|Khan, Asif|Kabat, Pavel",indus basin|precipitation distribution|high-altitude areas|gridded precipitation products|bias correction,10.1016/j.scitotenv.2016.01.001,SCIENCE OF THE TOTAL ENVIRONMENT,WOS:000370246000031,An appraisal of precipitation distribution in the high-altitude catchments of the Indus basin,2016,https://dx.doi.org/10.1016/j.scitotenv.2016.01.001
