192,WOS:000424560900058,2017,A morphodynamic model for cohesive sediments transport,"Peixoto, Rodrigo dos Santos|Colonna Rosman, Paulo Cesar|Vinzon, Susana Beatriz",RBRH-REVISTA BRASILEIRA DE RECURSOS HIDRICOS,erosion and sedimentation|environmental modeling|sediments transport|cohesive sediments,10.1590/2318-0331.0217170066,http://dx.doi.org/10.1590/2318-0331.0217170066
193,WOS:000392106300001,2017,"Rain or snow: hydrologic processes, observations, prediction, and research needs","Harpold, Adrian A.|Kaplan, Michael L.|Klos, P. Zion|Link, Timothy|McNamara, James P.|Rajagopal, Seshadri|Schumer, Rina|Steele, Caitriana M.",HYDROLOGY AND EARTH SYSTEM SCIENCES,,10.5194/hess-21-1-2017,http://dx.doi.org/10.5194/hess-21-1-2017
194,WOS:000418736700069,2017,What Determines Water Temperature Dynamics in the San Francisco Bay-Delta System?,"Vroom, J.|van der Wegen, M.|Martyr-Koller, R. C.|Lucas, L. V.",WATER RESOURCES RESEARCH,water temperature dynamics|numerical process-based modeling|san francisco bay-delta system|atmospheric heat exchange|delft3d-flexible mesh,10.1002/2016WR020062,http://dx.doi.org/10.1002/2016WR020062
195,WOS:000395435800046,2017,"Decreased Streamflow in the Yellow River Basin, China: Climate Change or Human-Induced?","Li, Bin|Li, Changyou|Liu, Jianyu|Zhang, Qiang|Duan, Limin",WATER,budyko hypothesis|hydrological processes|attribution evaluation|climate change|human activity,10.3390/w9020116,http://dx.doi.org/10.3390/w9020116
2021,WOS:000418407200004,2017,Evaluating preprocessing methods of digital elevation models for hydrological modelling,"Lidberg, William|Nilsson, Mats|Lundmark, Tomas|Agren, Anneli M.",HYDROLOGICAL PROCESSES,breaching|culverts|digital elevation model|lidar|preprocessing|roads,10.1002/hyp.11385,http://dx.doi.org/10.1002/hyp.11385
198,WOS:000417531000001,2017,An AgMIP framework for improved agricultural representation in integrated assessment models,"Ruane, Alex C.|Rosenzweig, Cynthia|Asseng, Senthold|Boote, Kenneth J.|Elliott, Joshua|Ewert, Frank|Jones, James W.|Martre, Pierre|McDermid, Sonali P.|Mueller, Christoph|Snyder, Abigail|Thorburn, Peter J.",ENVIRONMENTAL RESEARCH LETTERS,agmip|climate impacts|crop models|integrated assessment models|agricultural impacts|emulators|model development,10.1088/1748-9326/aa8da6,http://dx.doi.org/10.1088/1748-9326/aa8da6
2070,WOS:000397550100040,2017,Assessing the impact of changes in land-use intensity and climate on simulated trade-offs between crop yield and nitrogen leaching,"Blanke, Jan Hendrik|Olin, Stefan|Sturck, Julia|Sahlin, Ullrika|Lindeskog, Mats|Helming, John|Lehsten, Veiko",AGRICULTURE ECOSYSTEMS & ENVIRONMENT,land-use intensity projections|climate change|fertilization|trade-offs|nitrogen leaching|lpj-guess,10.1016/j.agee.2017.01.038,http://dx.doi.org/10.1016/j.agee.2017.01.038
144,WOS:000424833700001,2017,Improving the understanding and practice of hydrological modelling: recent insights and discussion,"Daniell, Trevor|Daniell, Katherine",AUSTRALIAN JOURNAL OF WATER RESOURCES,,10.1080/13241583.2017.1406586,http://dx.doi.org/10.1080/13241583.2017.1406586
2072,WOS:000406177500019,2017,A model for simulating the performance and irrigation of green stormwater facilities at residential scales in semiarid and Mediterranean regions,"Herrera, Josefina|Bonilla, Carlos A.|Castro, Lina|Vera, Sergio|Reyes, Rodolfo|Gironas, Jorge",ENVIRONMENTAL MODELLING & SOFTWARE,continuous simulation|soil water content|green infrastructure|hydrological modeling|irrigation|global sensitivity analysis,10.1016/j.envsoft.2017.06.020,http://dx.doi.org/10.1016/j.envsoft.2017.06.020
201,WOS:000397356000004,2017,Evaluating business models for microgrids: Interactions of technology and policy,"Hanna, Ryan|Ghonima, Mohamed|Kleissl, Jan|Tynan, George|Victor, David G.",ENERGY POLICY,decarbonization|decentralization|distributed energy resource|modeling|natural gas|renewable energy,10.1016/j.enpol.2017.01.010,http://dx.doi.org/10.1016/j.enpol.2017.01.010
2016,WOS:000397875300021,2017,"Modeling of the dispersion of thermotolerant coliforms and enterococci in two bays in the coastal region of Ubatuba (SP), Brazil","Batista, Silvana Simone|Harari, Joseph",ENGENHARIA SANITARIA E AMBIENTAL,environmental modeling|hydrodynamic modeling|water quality|fecal indicators|northern coast of sao paulo,10.1590/S1413-41522016158594,http://dx.doi.org/10.1590/S1413-41522016158594
203,WOS:000393631400013,2017,Design and demonstration of a data model to integrate agent-based and field-based modelling,"de Bakker, Merijn P.|de Jong, Kor|Schmitz, Oliver|Kaissenberg, Derek",ENVIRONMENTAL MODELLING & SOFTWARE,agent-based modelling|field-based modelling|integrated modelling|data model|map algebra|modelling language,10.1016/j.envsoft.2016.11.016,http://dx.doi.org/10.1016/j.envsoft.2016.11.016
2014,WOS:000396348500011,2017,Sensitivity of projected long-term CO2 emissions across the Shared Socioeconomic Pathways,"Marangoni, G.|Tavoni, M.|Bosetti, V.|Borgonovo, E.|Capros, P.|Fricko, O.|Gernaat, D. E. H. J.|Guivarch, C.|Havlik, P.|Huppmann, D.|Johnson, N.|Karkatsoulis, P.|Keppo, I.|Krey, V.|Broin, E. O.|Price, J.|van Vuuren, D. P.",NATURE CLIMATE CHANGE,,10.1038/NCLIMATE3199,http://dx.doi.org/10.1038/NCLIMATE3199
2013,WOS:000392678200004,2017,"Assessment of contaminant concentrations in sediments, fish and mussels sampled from the North Atlantic and European regional seas within the ICON project","Robinson, Craig D.|Webster, Lynda|Martinez-Gomez, Concepcion|Burgeot, Thierry|Gubbins, Matthew J.|Thain, John E.|Vethaak, A. Dick|McIntosh, Alistair D.|Hylland, Ketil",MARINE ENVIRONMENTAL RESEARCH,integrated assessment|ices|north atlantic|north sea|baltic sea|mediterranean sea|polycyclic aromatic hydrocarbons (pahs)|polychlorinated biphenyls (pcbs)|trace metals|environmental monitoring,10.1016/j.marenvres.2016.04.005,http://dx.doi.org/10.1016/j.marenvres.2016.04.005
2031,WOS:000394918000007,2017,Quantifying the role of permafrost distribution in groundwater and surface water interactions using a three-dimensional hydrological model,"Liao, Chang|Zhuang, Qianlai",ARCTIC ANTARCTIC AND ALPINE RESEARCH,,10.1657/AAAR0016-022,http://dx.doi.org/10.1657/AAAR0016-022
2034,WOS:000403512500010,2017,An overview of the system dynamics process for integrated modelling of socio-ecological systems: Lessons on good modelling practice from five case studies,"Elsawah, Sondoss|Pierce, Suzanne A.|Hamilton, Serena H.|van Delden, Hedwig|Haase, Dagmar|Elmandi, Amgad|Jakeman, Anthony J.",ENVIRONMENTAL MODELLING & SOFTWARE,system dynamics|integrated assessment|integrated modelling|socio-ecological systems|modelling practices|decision support,10.1016/j.envsoft.2017.03.001,http://dx.doi.org/10.1016/j.envsoft.2017.03.001
1982,WOS:000389090100077,2017,SIMSWASTE-AD - A modelling framework for the environmental assessment of agricultural waste management strategies: Anaerobic digestion,"Pardo, Guillermo|Moral, Raul|del Prado, Agustin",SCIENCE OF THE TOTAL ENVIRONMENT,biogas|manure|ghg emissions|modelling|lca|mitigation,10.1016/j.scitotenv.2016.09.096,http://dx.doi.org/10.1016/j.scitotenv.2016.09.096
2066,WOS:000397029600004,2017,"Atmospheric Dispersion of PM2.5 Precursor Gases from Two Major Thermal Power Plants in Andhra Pradesh, India","Dodla, Venkata Bhaskar Rao|Gubbala, China Satyanarayana|Desamsetti, Srinivas",AEROSOL AND AIR QUALITY RESEARCH,particulate matter|dispersion|power plants|arw model|hysplit,10.4209/aaqr.2016.07.0294,http://dx.doi.org/10.4209/aaqr.2016.07.0294
164,WOS:000406333700006,2017,"Spatial and Temporal Patterns in Thalassia testudinum Leaf Tissue Nutrients at the Chandeleur Islands, Louisiana, USA","Darnell, Kelly M.|Carruthers, Tim J. B.|Biber, Patrick|Georgiou, Ioannis Y.|Michot, Thomas C.|Boustany, Ronald G.",ESTUARIES AND COASTS,seagrass|louisiana|chandeleur islands|nitrogen|phosphorus,10.1007/s12237-017-0229-y,http://dx.doi.org/10.1007/s12237-017-0229-y
165,WOS:000436089500014,2017,"Hydrological Modeling of Sediment Transport in the Semi-arid Region, Case of Soubella Watershed in Algeria","Hasbaia, Mahmoud|Paquier, Andre|Herizi, Toufik|Abdalla, O|Kacimov, A|Chen, M|AlMaktoumi, A|AlHosni, T|Clark, ",WATER RESOURCES IN ARID AREAS: THE WAY FORWARD,semiarid region|algeria|sediment transport|hydrologic model|soubella|hodna,10.1007/978-3-319-51856-5_14,http://dx.doi.org/10.1007/978-3-319-51856-5_14
166,WOS:000403644700005,2017,Realizing modelling outcomes: A synthesis of success factors and their use in a retrospective analysis of 15 Australian water resource projects,"Merritt, W. S.|Fu, B.|Ticehurst, J. L.|El Sawah, S.|Vigiak, O.|Roberts, A. M.|Dyer, F.|Pollino, C. A.|Guillaume, J. H. A.|Croke, B. F. W.|Jakeman, A. J.",ENVIRONMENTAL MODELLING & SOFTWARE,decision support|evaluation|water resources|stakeholders|social learning|integrated modelling,10.1016/j.envsoft.2017.03.021,http://dx.doi.org/10.1016/j.envsoft.2017.03.021
2054,WOS:000418582900018,2017,Modelling the Energy Transition: Towards an Application of Agent Based Modelling to Integrated Assessment Modelling,"Kraan, Oscar|Kramer, Gert Jan|van der Lei, Telli|Huppes, Gjalt|Jager, W|Verbrugge, R|Flache, A|DeRoo, G|Hoogduin, L|Hemelrijk, C",ADVANCES IN SOCIAL SIMULATION 2015,integrated assessment modelling|agent based modelling|cost-benefit analysis|mitigation|adaptation|climate change,10.1007/978-3-319-47253-9_18,http://dx.doi.org/10.1007/978-3-319-47253-9_18
159,WOS:000408784000012,2017,Development of an integrated generic model for multi-scale assessment of the impacts of agro-ecosystems on major ecosystem services in West Africa,"Belem, Mahamadou|Saqalli, Mehdi",JOURNAL OF ENVIRONMENTAL MANAGEMENT,climate change|land use policy|integrated assessment modeling|coupled component model,10.1016/j.jenvman.2017.07.018,http://dx.doi.org/10.1016/j.jenvman.2017.07.018
157,WOS:000428311600130,2017,Leveraging Real-Time Network Analyses by Extending a Model-based Framework,"Long, Anh-Toan Bui|Ouhammou, Yassine|Grolleau, Emmanuel",2017 IEEE/ACS 14TH INTERNATIONAL CONFERENCE ON COMPUTER SYSTEMS AND APPLICATIONS (AICCSA),real-time|real-time analysis|network|model driven engineering|design|modeling,10.1109/AICCSA.2017.157,http://dx.doi.org/10.1109/AICCSA.2017.157
171,WOS:000407987400052,2017,Roles of Transport Limitations and Mineral Heterogeneity in Carbonation of Fractured Basalts,"Menefee, Anne H.|Li, Peiyuan|Giammar, Daniel E.|Ellis, Brian R.",ENVIRONMENTAL SCIENCE & TECHNOLOGY,,10.1021/acs.est.7b00326,http://dx.doi.org/10.1021/acs.est.7b00326
2044,WOS:000416784200033,2017,Optimized Deep Learning Framework for water Distribution Data-Driven Modeling,"Wu, Zheng Yi|Rahman, Atiqur|Saldarriaga, J","XVIII INTERNATIONAL CONFERENCE ON WATER DISTRIBUTION SYSTEMS, WDSA2016",deep learning|optimization|modelling|data analysis|water distribution main text,10.1016/j.proeng.2017.03.240,http://dx.doi.org/10.1016/j.proeng.2017.03.240
2043,WOS:000418899200095,2017,"Application of remote sensing and GIS-based hydrological modelling for flood risk analysis: a case study of District 8, Ho Chi Minh city, Vietnam","An Thi Ngoc Dang, |Kumar, Lalit",GEOMATICS NATURAL HAZARDS & RISK,remote sensing|gis|dem|hydrological model|flood hazard|flood map|scs tr-55 model|spatial analysis,10.1080/19475705.2017.1388853,http://dx.doi.org/10.1080/19475705.2017.1388853
176,WOS:000424392900006,2017,Disturbance Distance: quantifying forests' vulnerability to disturbance under current and future conditions,"Dolan, Katelyn A.|Hurtt, George C.|Flanagan, Steve A.|Fisk, Justin P.|Sahajpal, Ritvik|Huang, Chengquan|Le Page, Yannik|Dubayah, Ralph|Masek, Jeffrey G.",ENVIRONMENTAL RESEARCH LETTERS,forest disturbance|ecological modeling|remote sensing,10.1088/1748-9326/aa8ea9,http://dx.doi.org/10.1088/1748-9326/aa8ea9
2041,WOS:000398451000026,2017,Climate change impacts on a Mediterranean river and the associated interactions with the adjacent coastal area,"Mentzafou, Angeliki|Vamvakaki, Chrysa|Zacharias, Ierotheos|Gianni, Areti|Dimitriou, Elias",ENVIRONMENTAL EARTH SCIENCES,climate change|integrated water resource management|hydrological modelling|hydrodynamic modelling|spercheios river basin-maliakos gulf system,10.1007/s12665-017-6572-2,http://dx.doi.org/10.1007/s12665-017-6572-2
178,WOS:000413666500003,2017,How well-mixed is well mixed? Hydrodynamic-biokinetic model integration in an aerated tank of a full-scale water resource recovery facility,"Rehman, Usman|Audenaert, Wim|Amerlinck, Youri|Maere, Thomas|Arnaldos, Marina|Nopens, Ingmar",WATER SCIENCE AND TECHNOLOGY,activated sludge modelling|computational fluid dynamics|model integration|wastewater treatment|water resource recovery,10.2166/wst.2017.330,http://dx.doi.org/10.2166/wst.2017.330
2040,WOS:000403233200005,2017,Hydrological threats to riparian wetlands of international importance - a global quantitative and qualitative analysis,"Schneider, Christof|Floerke, Martina|De Stefano, Lucia|Petersen-Perlman, Jacob D.",HYDROLOGY AND EARTH SYSTEM SCIENCES,,10.5194/hess-21-2799-2017,http://dx.doi.org/10.5194/hess-21-2799-2017
2038,WOS:000400108700004,2017,Automatic Ground Surface Reconstruction from mobile laser systems for driving simulation engines,"Craciun, Daniela|Deschaud, Jean-Emmanuel|Goulette, Francois",SIMULATION-TRANSACTIONS OF THE SOCIETY FOR MODELING AND SIMULATION INTERNATIONAL,surface reconstruction|lidar|driving simulator engines|road network|mobile laser systems,10.1177/0037549716683022,http://dx.doi.org/10.1177/0037549716683022
2063,WOS:000405243600006,2017,OPTION PRICING AND HEDGING WITH EXECUTION COSTS AND MARKET IMPACT,"Gueant, Olivier|Pu, Jiang",MATHEMATICAL FINANCE,option pricing|option hedging|illiquid markets|optimal execution|stochastic optimal control,10.1111/mafi.12102,http://dx.doi.org/10.1111/mafi.12102
2035,WOS:000393751600005,2017,Regression analysis for bivariate gap time with missing first gap time data,"Huang, Chia-Hui|Chen, Yi-Hau",LIFETIME DATA ANALYSIS,bivariate duration time|counting process|dependent censoring|ordered data,10.1007/s10985-016-9370-3,http://dx.doi.org/10.1007/s10985-016-9370-3
184,WOS:000393525800002,2017,Prioritising the placement of riparian vegetation to reduce flood risk and end-of-catchment sediment yields: Important considerations in hydrologically-variable regions,"Croke, Jacky|Thompson, Chris|Fryirs, Kirstie",JOURNAL OF ENVIRONMENTAL MANAGEMENT,river restoration|passive restoration|catchment action plan|bench|genetic floodplain,10.1016/j.jenvman.2016.12.046,http://dx.doi.org/10.1016/j.jenvman.2016.12.046
2008,WOS:000418736000014,2017,Twentieth-Century Hydrometeorological Reconstructions to Study the Multidecadal Variations of the Water Cycle Over France,"Bonnet, R.|Bae, J.|Dayon, G.|Martin, E.",WATER RESOURCES RESEARCH,,10.1002/2017WR020596,http://dx.doi.org/10.1002/2017WR020596
2074,WOS:000399868000012,2017,A GIS-based urban and peri-urban landscape representation toolbox for hydrological distributed modeling,"Sanzana, P.|Gironas, J.|Braud, I.|Branger, F.|Rodriguez, F.|Vargas, X.|Hitschfeld, N.|Munoz, J. F.|Vicuna, S.|Mejia, A.|Jankowfsky, S.",ENVIRONMENTAL MODELLING & SOFTWARE,peri-urban catchments|hydrological response units|urban hydrological elements|drainage extraction|computer-assisted mesh generation,10.1016/j.envsoft.2017.01.022,http://dx.doi.org/10.1016/j.envsoft.2017.01.022
211,WOS:000430181700091,2017,Reshaping the Activated Sludge Model ASM2d for Better Manageability and Higher Integration Potential,"Pham, H. H.|Wouters, Y.|Dalmau, M.|Comas, J.|Smets, I.|Mannina, G","FRONTIERS IN WASTEWATER TREATMENT AND MODELLING, FICWTM 2017",wastewater treatment modeling|asm2d|model integration,10.1007/978-3-319-58421-8_91,http://dx.doi.org/10.1007/978-3-319-58421-8_91
2003,WOS:000395607700020,2017,Water fluxes between inter-patches and vegetated mounds in flat semiarid landscapes,"Rossi, Maria J.|Ares, Jorge O.",JOURNAL OF HYDROLOGY,infiltration|runoff|vegetated mound|preferential infiltration|soil micro-topography,10.1016/j.jhydro1.2017.01.016,http://dx.doi.org/10.1016/j.jhydro1.2017.01.016
230,WOS:000398972500010,2017,Towards a Multidimensional Approach to Bayesian Disease Mapping,"Martinez-Beneito, Miguel A.|Botella-Rocamora, Paloma|Banerjee, Sudipto",BAYESIAN ANALYSIS,,10.1214/16-BA995,http://dx.doi.org/10.1214/16-BA995
231,WOS:000396741400001,2017,Can integrative catchment management mitigate future water quality issues caused by climate change and socio-economic development?,"Honti, Mark|Schuwirth, Nele|Rieckermann, Jorg|Stamm, Christian",HYDROLOGY AND EARTH SYSTEM SCIENCES,,10.5194/hess-21-1593-2017,http://dx.doi.org/10.5194/hess-21-1593-2017
232,WOS:000403644700007,2017,Improved modelling of the freshwater provisioning ecosystem service in water scarce river basins,"Momblanch, Andrea|Paredes-Arquiola, Javier|Andreu, Joaquin",ENVIRONMENTAL MODELLING & SOFTWARE,ecosystem services|freshwater provisioning|water resources management|integrated modelling|water scarcity|aquatool,10.1016/j.envsoft.2017.03.033,http://dx.doi.org/10.1016/j.envsoft.2017.03.033
470,WOS:000400522200011,2017,The Role of Social Networks and Information Sources on Hurricane Evacuation Decision Making,"Sadri, Arif Mohaimin|Ukkusuri, Satish V.|Gladwin, Hugh",NATURAL HAZARDS REVIEW,evacuation|individual-level|hurricane sandy|social network|multinomial logit|random parameters,10.1061/(ASCE)NH.1527-6996.0000244,http://dx.doi.org/10.1061/(ASCE)NH.1527-6996.0000244
233,WOS:000415638000001,2017,Integrated assessment and scenarios simulation of urban water security system in the southwest of China with system dynamics analysis,"Su Yin, |Guan Dongjie, |Su Weici, |Gao Weijun, ",WATER SCIENCE AND TECHNOLOGY,driving factor|scenario parameters|system dynamics|urban water security system,10.2166/wst.2017.333,http://dx.doi.org/10.2166/wst.2017.333
234,WOS:000397300200007,2017,Developing an Integrated Modeling Tool for River Water Quality Index Assessment,"Lai, Y. C.|Chien, C. C.|Yang, Z. H.|Surampalli, Rao Y.|Kao, C. M.",WATER ENVIRONMENT RESEARCH,ammonia|electric conductivity (ec)|river water quality|suspended solid (ss)|water quality index (wqi5),10.2175/106143016X14798353399584,http://dx.doi.org/10.2175/106143016X14798353399584
2083,WOS:000408755300001,2017,Assessing the use of delta O-18 in phosphate as a tracer for catchment phosphorus sources,"Tonderski, Karin|Andersson, Lotta|Lindstrom, Goran|St Cyr, Rasmus|Schoenberg, Ronny|Taubald, Heinrich",SCIENCE OF THE TOTAL ENVIRONMENT,drainage pipes|hydrological pathways|oxygen isotopes|sewage|source apportionment,10.1016/j.scitotenv.2017.06.167,http://dx.doi.org/10.1016/j.scitotenv.2017.06.167
1996,WOS:000401451100006,2017,A stakeholder consultation into hydro-meteorological e-science environments,"Harpham, Quillon|Gimeno, Olalla|Parodi, Antonio|D'Agostino, Daniele",EARTH SCIENCE INFORMATICS,hydro-meteorology|e-science|ict infrastructure|standards|stakeholder consultation,10.1007/s12145-017-0294-6,http://dx.doi.org/10.1007/s12145-017-0294-6
236,WOS:000414818700006,2017,Assessment of environmental impacts and operational costs of the implementation of an innovative source-separated urine treatment,"Igos, Elorri|Besson, Mathilde|Gutierrez, Tomas Navarrete|de Faria, Ana Barbara Bisinella|Benetto, Enrico|Barna, Ligia|Ahmadi, Aras|Sperandio, Mathieu",WATER RESEARCH,source-separated urine treatment|process simulation|sustainability assessment|innovative technology|integrated modelling,10.1016/j.watres.2017.09.016,http://dx.doi.org/10.1016/j.watres.2017.09.016
1994,WOS:000413376800007,2017,Two-way coupling of magnetohydrodynamic simulations with embedded particle-in-cell simulations,"Makwana, K. D.|Keppens, R.|Lapenta, G.",COMPUTER PHYSICS COMMUNICATIONS,mhd|pic|space plasmas|multi-scale,10.1016/j.cpc.2017.08.003,http://dx.doi.org/10.1016/j.cpc.2017.08.003
240,WOS:000403800000007,2017,Hydrological modelling of the Vistula and Odra river basins using SWAT,"Piniewski, M.|Szczesniak, M.|Kardel, I.|Berezowski, T.|Okruszko, T.|Srinivasan, R.|Schuler, D. Vikhamar|Kundzewicz, Z. W.",HYDROLOGICAL SCIENCES JOURNAL-JOURNAL DES SCIENCES HYDROLOGIQUES,regionalization|blue water|green water|spatial calibration|hydrological modelling|open source data,10.1080/02626667.2017.1321842,http://dx.doi.org/10.1080/02626667.2017.1321842
1993,WOS:000418899200082,2017,Risk assessment of typhoon disaster for the Yangtze River Delta of China,"Zhang, Yong|Fan, Gaofeng|He, Yue|Cao, Lijuan",GEOMATICS NATURAL HAZARDS & RISK,typhoon disaster|exposure|vulnerability|risk assessment|the yangtze river delta,10.1080/19475705.2017.1362040,http://dx.doi.org/10.1080/19475705.2017.1362040
2090,WOS:000406725800051,2017,A societal metabolism approach to job creation and renewable energy transitions in Catalonia,"Rodriguez-Huerta, Edgar|Rosas-Casals, Marti|Sorman, Alevgul H.",ENERGY POLICY,musiasem|energy transitions|energy planning|catalonia,10.1016/j.enpol.2017.06.024,http://dx.doi.org/10.1016/j.enpol.2017.06.024
123,WOS:000412250900108,2017,Modelling carbon dioxide emissions from agricultural soils in Canada,"Yadav, Dhananjay|Wang, Junye",ENVIRONMENTAL POLLUTION,carbon dioxide emissions|dndc model|agricultural management|environmental modelling,10.1016/j.envpol.2017.07.066,http://dx.doi.org/10.1016/j.envpol.2017.07.066
1989,WOS:000398190000009,2017,MECHANISTIC MODELING OF PESTICIDE EXPOSURE: THE MISSING KEYSTONE OF HONEY BEE TOXICOLOGY,"Sponsler, Douglas B.|Johnson, Reed M.",ENVIRONMENTAL TOXICOLOGY AND CHEMISTRY,behavioral toxicology|pesticide risk assessment|environmental modeling|apis mellifera|pollinator|foraging,10.1002/etc.3661,http://dx.doi.org/10.1002/etc.3661
1985,WOS:000393249300038,2017,"Assessing global resource use and greenhouse emissions to 2050, with ambitious resource efficiency and climate mitigation policies","Hatfield-Dodds, Steve|Schandl, Heinz|Newth, David|Obersteiner, Michael|Cai, Yiyong|Baynes, Tim|West, James|Havlik, Petr",JOURNAL OF CLEANER PRODUCTION,resource efficiency|climate mitigation|policy analysis|decoupling,10.1016/j.jclepro.2016.12.170,http://dx.doi.org/10.1016/j.jclepro.2016.12.170
1983,WOS:000408729200044,2017,Water Resources of the Black Sea Catchment under Future Climate and Landuse Change Projections,"Freund, Elham Rouholahnejad|Abbaspour, Karim C.|Lehmann, Anthony",WATER,hydrology|danube|don|dnieper|land use change|hydrological modeling,10.3390/w9080598,http://dx.doi.org/10.3390/w9080598
229,WOS:000415769600007,2017,Potential implications of climate change and urbanization on watershed hydrology,"Pumo, D.|Arnone, E.|Francipane, A.|Caracciolo, D.|Noto, L. V.",JOURNAL OF HYDROLOGY,hydrological change|climate change|land use and cover change|urbanization|tribs,10.1016/j.jhydrol.2017.09.002,http://dx.doi.org/10.1016/j.jhydrol.2017.09.002
228,WOS:000403512500017,2017,"Challenges of integrated modelling in mining regions to address social, environmental and economic impacts","Lechner, Alex M.|McIntyre, Neil|Witt, Katherine|Raymond, Christopher M.|Arnold, Sven|Scott, Margaretha|Rifldn, Will",ENVIRONMENTAL MODELLING & SOFTWARE,mining|resource extraction|integrative modelling|strategic environmental assessment|cumulative impacts|land use planning,10.1016/j.envsoft.2017.03.020,http://dx.doi.org/10.1016/j.envsoft.2017.03.020
227,WOS:000394157300007,2017,Impact of climate change on vulnerability of forests and ecosystem service supply in Western Rhodopes Mountains,"Zlatanov, Tzvetan|Elkin, Che|Irauschek, Florian|Lexer, Manfred Josef",REGIONAL ENVIRONMENTAL CHANGE,climate change|forest ecosystem services|ecosystem modelling|sustainable forest management,10.1007/s10113-015-0869-z,http://dx.doi.org/10.1007/s10113-015-0869-z
219,WOS:000419147303051,2017,Vertically integrated dual-porosity and dual-permeability models for CO2 sequestration in fractured geological formation,"Guo, Bo|Tao, Yiheng|Bandilla, Karl|Celia, Michael|Dixon, T|Laloui, L|Twinning, S","13TH INTERNATIONAL CONFERENCE ON GREENHOUSE GAS CONTROL TECHNOLOGIES, GHGT-13",vertically integrated models|dual-continuum models|co2 storage|fracture flow,10.1016/j.egypro.2017.03.1466,http://dx.doi.org/10.1016/j.egypro.2017.03.1466
136,WOS:000400158700012,2017,Challenges on field monitoring of indoor air quality in china,"Ho, Steven Sai Hang|Huang, Yu|Lee, Shun-Cheng|Cao, Junji",INDOOR AND BUILT ENVIRONMENT,indoor air quality|field monitoring|china|measurement protocols|exposure,10.1177/1420326X15626991,http://dx.doi.org/10.1177/1420326X15626991
135,WOS:000416793400183,2017,Resources for Sustainable Economic Development: A Framework for Evaluating Infrastructure System Alternatives,"Duchin, Faye",SUSTAINABILITY,public infrastructure|sustainable development|case-study research strategy|scenario analysis|world input-output model|dynamic input-output model,10.3390/su9112105,http://dx.doi.org/10.3390/su9112105
134,WOS:000390373400149,2017,An integrated assessment framework for the analysis of multiple pressures in aquatic ecosystems and the appraisal of management options,"Pistocchi, A.|Udias, A.|Grizzetti, B.|Gelati, E.|Koundouri, P.|Ludwig, R.|Papandreou, A.|Souliotis, I.",SCIENCE OF THE TOTAL ENVIRONMENT,multiple pressures|water bodies status|water framework directive|decision support|river basin management measures|optimization,10.1016/j.scitotenv.2016.10.020,http://dx.doi.org/10.1016/j.scitotenv.2016.10.020
133,WOS:000413145100001,2017,Investigation of the scaling characteristics of LANDSAT temperature and vegetation data: a wavelet-based approach,"Rathinasamy, Maheswaran|Bindhu, V. M.|Adamowski, Jan|Narasimhan, Balaji|Khosa, Rakesh",INTERNATIONAL JOURNAL OF BIOMETEOROLOGY,scaling|ndvi|landsat|wavelet multiresolution|temperature|vegetation,10.1007/s00484-017-1353-x,http://dx.doi.org/10.1007/s00484-017-1353-x
