153,"Peixoto, R. G.|Anacleto, F. E. S.|Ribeiro, G. O.|Pitangueira, R. L. S.|Penna, S. S.",implicit boundary element method|solution strategy|unified constitutive modelling framework|control methods,10.1016/j.enganabound.2015.11.017,ENGINEERING ANALYSIS WITH BOUNDARY ELEMENTS,WOS:000370306000024,A solution strategy for non-linear implicit BEM formulation using a unified constitutive modelling framework,2016,https://dx.doi.org/10.1016/j.enganabound.2015.11.017
1172,"Bouklia-Hassane, Rachid|Yebdri, Djilali|Tidjani, Abdellatif El-Bari",integrated water resources management|irrigation|hydrological modeling|oran province|simulations|water policies|weap model,10.1080/19443994.2014.984341,DESALINATION AND WATER TREATMENT,WOS:000368690300029,Prospects for a larger integration of the water resources system using WEAP model: a case study of Oran province,2016,https://dx.doi.org/10.1080/19443994.2014.984341
1406,"Chun, Seung-Hoon|Cha, Yoon-Jung|Park, Sang-Gil|Kim, Chae-Back",,,11TH INTERNATIONAL SYMPOSIUM ON ECOHYDRAULICS,WOS:000401732900168,DEVELOPMENT OF STANDARIZED-INTEGRATED ASSESSMENT SYSTEM FOR RIVER/STREAM ENVIRONMENT IN KOREA,2016,https://dx.doi.org/
151,"Yang, Siyuan|Chen, Bin|Ulgiati, Sergio|Yan, J|Wennersten, R|Chen, B|Yang, J|Lv, Y|Sun, Q",co2|pm2.5|input-output analysis|china,10.1016/j.egypro.2016.12.017,CLEAN ENERGY FOR CLEAN CITY: CUE 2016 - APPLIED ENERGY SYMPOSIUM AND FORUM: LOW-CARBON CITIES AND URBAN ENERGY SYSTEMS,WOS:000391447900016,Co-benefits of CO2 and PM2.5 emission reduction,2016,https://dx.doi.org/10.1016/j.egypro.2016.12.017
30,"Yen, Haw|Daggupati, Prasad|White, Michael J.|Srinivasan, Raghavan|Gossel, Arndt|Wells, David|Arnold, Jeffrey G.",decision support system|watershed modeling|web-based application|model calibration|swat,10.3390/w8040164,WATER,WOS:000375157200055,"Application of Large-Scale, Multi-Resolution Watershed Modeling Framework Using the Hydrologic and Water Quality System (HAWQS)",2016,https://dx.doi.org/10.3390/w8040164
1175,"Ushakov, K. V.|Grankina, T. B.|Ibrayev, R. A.|Gromov, I. V.|Gordov, E|Lykosov, ",,10.1088/1755-1315/48/1/012013,"INTERNATIONAL CONFERENCE AND EARLY CAREER SCIENTISTS SCHOOL ON ENVIRONMENTAL OBSERVATIONS, MODELLING AND INFORMATION SYSTEMS (ENVIROMIS-2016)",WOS:000389752200013,Simulation of Arctic and North Atlantic ocean water and ice seasonal characteristics by the INMIO-CICE coupled model,2016,https://dx.doi.org/10.1088/1755-1315/48/1/012013
1161,"Li, Weihua|Sankarasubramanian, A.|Ranjithan, R. S.|Sinha, Tushar",multimodel combination|data assimilation|ensemble kalman filter|streamflow forecast|uncertainty reduction,10.1007/s00477-015-1158-6,STOCHASTIC ENVIRONMENTAL RESEARCH AND RISK ASSESSMENT,WOS:000393196000018,Role of multimodel combination and data assimilation in improving streamflow prediction over multiple time scales,2016,https://dx.doi.org/10.1007/s00477-015-1158-6
1158,"Andersen, Jesper H.|Aroviita, Jukka|Carstensen, Jacob|Friberg, Nikolai|Johnson, Richard K.|Kauppila, Pirkko|Lindegarth, Mats|Murray, Ciaran|Norling, Karl",,10.1007/s13280-016-0767-8,AMBIO,WOS:000382860500004,Approaches for integrated assessment of ecological and eutrophication status of surface waters in Nordic Countries,2016,https://dx.doi.org/10.1007/s13280-016-0767-8
1421,"Han, Fei|Cheng, Lin",,10.1155/2016/7289621,DISCRETE DYNAMICS IN NATURE AND SOCIETY,WOS:000373469000001,The Role of Initial Credit Distribution Scheme in Managing Network Mobility and Maximizing Reserve Capacity: Considering Traveler's Cognitive Illusion,2016,https://dx.doi.org/10.1155/2016/7289621
1146,"Fossey, M.|Rousseau, A. N.|Savary, S.",wetlands|hydrotel|hydrological functions|high flows|low flows|hydrologic modelling,10.1002/hyp.10750,HYDROLOGICAL PROCESSES,WOS:000379192700010,Assessment of the impact of spatio-temporal attributes of wetlands on stream flows using a hydrological modelling framework: a theoretical case study of a watershed under temperate climatic conditions,2016,https://dx.doi.org/10.1002/hyp.10750
1141,"Li, Yan|Thompson, Julian R.|Li, Hengpeng",soil and water assessment tool|orographic effect|spatial climatic representation|sequential uncertainty fitting|hydrological processes,10.3390/w8030073,WATER,WOS:000373691200014,"Impacts of Spatial Climatic Representation on Hydrological Model Calibration and Prediction Uncertainty: A Mountainous Catchment of Three Gorges Reservoir Region, China",2016,https://dx.doi.org/10.3390/w8030073
1142,"Smith, Pete",biochar|carbon|negative emission technology|sequestration|soil,10.1111/gcb.13178,GLOBAL CHANGE BIOLOGY,WOS:000370491400029,Soil carbon sequestration and biochar as negative emission technologies,2016,https://dx.doi.org/10.1111/gcb.13178
1419,"Krause, Julia|Nicolai, Jana|Maerten, Horst|Drebenstedt, C|Paul, M",in-situ recovery (isr)|wellfield design|3d hydrological modeling|aquifer restoration,,MINING MEETS WATER - CONFLICTS AND SOLUTIONS,WOS:000402663400216,Hydrological Characterization and Optimization of In-Situ Recovery,2016,https://dx.doi.org/
1418,"Ayala, A.|Pellicciotti, F.|MacDonell, S.|McPhee, J.|Vivero, S.|Campos, C.|Egli, P.",glacio-hydrological models|debris-covered glaciers|semiarid andes|topkapi-eth,10.1002/hyp.10971,HYDROLOGICAL PROCESSES,WOS:000388275200004,Modelling the hydrological response of debris-free and debris-covered glaciers to present climatic conditions in the semiarid Andes of central Chile,2016,https://dx.doi.org/10.1002/hyp.10971
1417,"Hegdahl, Trine J.|Tallaksen, Lena M.|Engeland, Kolbjorn|Burkhart, John F.|Xu, Chong-Yu",discharge/runoff|glacier|himalaya|hydrological modelling|snowmelt parameterization,10.2166/nh.2016.047,HYDROLOGY RESEARCH,WOS:000381718100003,"Discharge sensitivity to snowmelt parameterization: a case study for Upper Beas basin in Himachal Pradesh, India",2016,https://dx.doi.org/10.2166/nh.2016.047
1145,"Chen, Jie|Brissette, Francois P.|Zhang, Xunchang J.",multisite weather generator (mulgets)|hydrological modeling|interstation correlation|single-site weather generator (weagets),10.1061/(ASCE)HE.1943-5584.0001288,JOURNAL OF HYDROLOGIC ENGINEERING,WOS:000368805800014,Hydrological Modeling Using a Multisite Stochastic Weather Generator,2016,https://dx.doi.org/10.1061/(ASCE)HE.1943-5584.0001288
1416,"Gurung, Astrid Bjornsen|Borsdorf, Axel|Fuereder, Leopold|Kienast, Felix|Matt, Peter|Scheidegger, Christoph|Schmocker, Lukas|Zappa, Massimiliano|Volkart, Kathrin",austria|energy transition|alps|environmental impacts|pumped storage hydropower|sustainability assessment|switzerland,10.1659/MRD-JOURNAL-D-15-00069.1,MOUNTAIN RESEARCH AND DEVELOPMENT,WOS:000377708400011,Rethinking Pumped Storage Hydropower in the European Alps A Call for New Integrated Assessment Tools to Support the Energy Transition,2016,https://dx.doi.org/10.1659/MRD-JOURNAL-D-15-00069.1
1157,"Jajarmizadeh, Milad|Sidek, Lariyah Mohd|Mirzai, Majid|Alaghmand, Sina|Harun, Sobri|Majid, Mohammad Rafee",arid region|cfsr|hydrology|reanalysis data|swat model,10.1007/s11269-016-1303-0,WATER RESOURCES MANAGEMENT,WOS:000374593500003,Prediction of Surface Flow by Forcing of Climate Forecast System Reanalysis Data,2016,https://dx.doi.org/10.1007/s11269-016-1303-0
1149,"Joshi, Deepti|St-Hilaire, Andre|Ouarda, Taha B. M. J.|Daigle, Anik|Thiemonge, Nathalie",statistical downscaling|relevance vector machine|multiple linear regression|canonical correlation analysis|low flows|hydrological modelling,10.1080/02626667.2014.966719,HYDROLOGICAL SCIENCES JOURNAL-JOURNAL DES SCIENCES HYDROLOGIQUES,WOS:000381024600002,Comparison of direct statistical and indirect statistical-deterministic frameworks in downscaling river low-flow indices,2016,https://dx.doi.org/10.1080/02626667.2014.966719
1152,"Allen, Thomas|Prosperi, Paolo",food and nutrition security|social-ecological systems|vulnerability|resilience|dynamic systems|metrics,10.1007/s00267-016-0664-8,ENVIRONMENTAL MANAGEMENT,WOS:000374174800002,Modeling Sustainable Food Systems,2016,https://dx.doi.org/10.1007/s00267-016-0664-8
1153,"Guariso, G.|Maione, M.|Volta, M.",air quality planning|policy design|cost-benefit integration|european iam database,10.1016/j.envsci.2016.05.001,ENVIRONMENTAL SCIENCE & POLICY,WOS:000382595000002,A decision framework for Integrated Assessment Modelling of air quality at regional and local scale,2016,https://dx.doi.org/10.1016/j.envsci.2016.05.001
26,"Javelle, Pierre|Organde, Didier|Demargne, Julie|Saint-Martin, Clotilde|de Saint-Aubin, Celine|Garandeau, Lea|Janet, Bruno|Lang, M|Klijn, F|Samuels, P",,10.1051/e3sconf/20160718010,3RD EUROPEAN CONFERENCE ON FLOOD RISK MANAGEMENT (FLOODRISK 2016),WOS:000392270100193,Setting up a French national flash flood warning system for ungauged catchments based on the AIGA method,2016,https://dx.doi.org/10.1051/e3sconf/20160718010
162,"Berendrecht, W. L.|van Geer, F. C.",dynamic factor model|time series modeling|multivariate analysis|groundwater head|gap filling|outlier detection,10.1016/j.jhydrol.2016.02.028,JOURNAL OF HYDROLOGY,WOS:000374811200005,A dynamic factor modeling framework for analyzing multiple groundwater head series simultaneously,2016,https://dx.doi.org/10.1016/j.jhydrol.2016.02.028
1413,"Rossi, Marcelo Margon|Ternes, Sonia",basic reproduction number|epidemiology|invasive species|invasive epidemic models|ecological modeling,10.1111/nrm.12113,NATURAL RESOURCE MODELING,WOS:000387778900006,A SIMPLE LINEARIZATION PROCEDURE FOR OBTAINING R-0 FROM INVASIVE EPIDEMIC MODELS,2016,https://dx.doi.org/10.1111/nrm.12113
1426,"Offermans, Astrid|Valkering, Pieter",acceptability|perspectives|social robustness|sustainable river management,10.1061/(ASCE)WR.1943-5452.0000615,JOURNAL OF WATER RESOURCES PLANNING AND MANAGEMENT,WOS:000368828800025,Socially Robust River Management: Role of Perspective Dependent Acceptability Thresholds,2016,https://dx.doi.org/10.1061/(ASCE)WR.1943-5452.0000615
1337,"Chen, Wenying|Yin, Xiang|Zhang, Hongjun",,10.1007/s10584-013-0937-7,CLIMATIC CHANGE,WOS:000375682100008,Towards low carbon development in China: a comparison of national and global models,2016,https://dx.doi.org/10.1007/s10584-013-0937-7
174,"Voinov, Alexey|Kolagani, Nagesh|McCall, Michael K.|Glynn, Pierre D.|Kragt, Marit E.|Ostermann, Frank O.|Pierce, Suzanne A.|Ramu, Palaniappan",citizen science|social media|serious games|crowdsourcing|biases|uncertainty,10.1016/j.envsoft.2015.11.016,ENVIRONMENTAL MODELLING & SOFTWARE,WOS:000370885000016,Modelling with stakeholders - Next generation,2016,https://dx.doi.org/10.1016/j.envsoft.2015.11.016
1452,"Machado, Aline R.|Wendland, Edson|Krause, Peter",hydrology|water balance method|baseflow estimation|groundwater|outcrop zone|hydrological modeling,10.1007/s40710-016-0128-4,ENVIRONMENTAL PROCESSES-AN INTERNATIONAL JOURNAL,WOS:000446216700002,Hydrologic Simulation for Water Balance Improvement in an Outcrop Area of the Guarani Aquifer System,2016,https://dx.doi.org/10.1007/s40710-016-0128-4
1458,"Kirchner, Mathias|Schoenhart, Martin|Schmid, Erwin",agri-environmental program|spatial targeting|climate change impacts|cap post-2013|integrated analysis,10.1016/j.ecolecon.2015.12.009,ECOLOGICAL ECONOMICS,WOS:000371361000004,Spatial impacts of the CAP post-2013 and climate change scenarios on agricultural intensification and environment in Austria,2016,https://dx.doi.org/10.1016/j.ecolecon.2015.12.009
1072,"Hiasa, Shuhei|Noori, Mehdi|Kelly, Carolina|Tatari, Omer",system dynamics|techno-ecological modeling|environmental impacts of highway construction|urban forests|green infrastructure,10.1016/j.jclepro.2015.12.025,JOURNAL OF CLEANER PRODUCTION,WOS:000371187500009,Dynamic techno-ecological modeling of highway systems: a case study of the Shin-Meishin Expressway in Japan,2016,https://dx.doi.org/10.1016/j.jclepro.2015.12.025
1073,"Roy, Tirthankar|Schuetze, Niels|Grundmann, Jens|Brettschneider, Marco|Jain, Ashu",artificial neural network|coastal aquifers|evolution strategies|gaussian process model|optimal groundwater management|surrogate modeling,10.2166/hydro.2016.086,JOURNAL OF HYDROINFORMATICS,WOS:000379214900005,Optimal groundwater management using state-space surrogate models: a case study for an arid coastal region,2016,https://dx.doi.org/10.2166/hydro.2016.086
1074,"Bernard-Jannin, Leonard|Brito, David|Sun, Xiaoling|Jauch, Eduardo|Neves, Ramiro|Sauvage, Sabine|Sanchez-Perez, Jose-Miguel",floodplain|hydrological modelling|water exchanges|river-aquifer interface|3d model,10.1016/j.advwatres.2016.05.008,ADVANCES IN WATER RESOURCES,WOS:000381529000012,Spatially distributed modelling of surface water-groundwater exchanges during overbank flood events - a case study at the Garonne River,2016,https://dx.doi.org/10.1016/j.advwatres.2016.05.008
1456,"Muratori, Matteo|Calvin, Katherine|Wise, Marshall|Kyle, Page|Edmonds, Jae",bioenergy|carbon capture and storage (ccs)|beccs|integrated assessment|gcam|energy trade|food price,10.1088/1748-9326/11/9/095004,ENVIRONMENTAL RESEARCH LETTERS,WOS:000384060600002,Global economic consequences of deploying bioenergy with carbon capture and storage (BECCS),2016,https://dx.doi.org/10.1088/1748-9326/11/9/095004
1455,"Garcia-Prats, Alberto|del Campo, Antonio D.|Pulido-Velazquez, Manuel",hydrology-oriented silviculture|natural water retention measures|water and forest|groundwater recharge|hydroeconomic modeling|hydrus,10.1002/2015WR018273,WATER RESOURCES RESEARCH,WOS:000388493400042,A hydroeconomic modeling framework for optimal integrated management of forest and water,2016,https://dx.doi.org/10.1002/2015WR018273
1454,"Koziel, Slawomir|Bekasiewicz, Adrian",simulation-driven design|computer-aided design (cad)|geometry scaling|inverse modeling|microwave structures|surrogate modeling,10.1108/EC-07-2015-0192,ENGINEERING COMPUTATIONS,WOS:000379018600007,Inverse surrogate modeling for low-cost geometry scaling of microwave and antenna structures,2016,https://dx.doi.org/10.1108/EC-07-2015-0192
1453,"Hraniciuc, Tomi Alexandrel|Cercel, Petru",hydrological modeling|hydraulic modeling|flood hazard|flood risk|calibration of hydraulic and hydrological parameters,,"WATER, RESOURCES, FOREST, MARINE AND OCEAN ECOSYSTEMS CONFERENCE PROCEEDINGS, VOL I",WOS:000391653400028,COUPLED HYDROLOGICAL AND HYDRAULIC MODELING OF DANGEROUS METEOROLOGICAL PHENOMENA,2016,https://dx.doi.org/
198,"Li, Jianping|Li, Minglu|Wu, Dengsheng|Dai, Qianzhi|Song, Hao",software process risk|risk identification|risk correlation|bayesian network|trustworthy software,10.1142/S0219622016500401,INTERNATIONAL JOURNAL OF INFORMATION TECHNOLOGY & DECISION MAKING,WOS:000389228700006,A Bayesian Networks-Based Risk Identification Approach for Software Process Risk: The Context of Chinese Trustworthy Software,2016,https://dx.doi.org/10.1142/S0219622016500401
1460,"Schmitt, Rafael J. P.|Bizzi, Simone|Castelletti, Andrea",sediment transport modeling|sediment connectivity|sediment cascades|river network scale,10.1002/2015WR018097,WATER RESOURCES RESEARCH,WOS:000379259800039,Tracking multiple sediment cascades at the river network scale identifies controls and emerging patterns of sediment connectivity,2016,https://dx.doi.org/10.1002/2015WR018097
8,"Saagi, Ramesh|Flores-Alsina, Xavier|Fu, Guangtao|Butler, David|Gernaey, Krist V.|Jeppsson, Ulf",benchmark simulation models|combined sewer overflows|integrated control|system-wide evaluation|urban drainage models,10.1016/j.envsoft.2015.12.013,ENVIRONMENTAL MODELLING & SOFTWARE,WOS:000371377800002,Catchment & sewer network simulation model to benchmark control strategies within urban wastewater systems,2016,https://dx.doi.org/10.1016/j.envsoft.2015.12.013
1450,"Ma, Qiang|Zavattero, Elodie|Du, Mingxuan|Ngoc Duong Vo, |Gourbesville, Philippe|Kim, JH|Kim, HS|Yoo, DG|Jung, D|Song, CG",high resolution topography|sensitivity analysis|deterministic hydrological model|extreme rainfall-runoff|var basin,10.1016/j.proeng.2016.07.558,12TH INTERNATIONAL CONFERENCE ON HYDROINFORMATICS (HIC 2016) - SMART WATER FOR THE FUTURE,WOS:000385793200082,Assessment of High Resolution Topography Impacts on Deterministic Distributed Hydrological Model in Extreme Rainfall-runoff Simulation,2016,https://dx.doi.org/10.1016/j.proeng.2016.07.558
9,"Sahoo, Sanat Nalini|Sreeja, P.",imperviousness|effective impervious area|total impervious area|remote sensing|satellite imagery|geographic information system,10.1061/(ASCE)HE.1943-5584.0001346,JOURNAL OF HYDROLOGIC ENGINEERING,WOS:000372804000011,Determination of Effective Impervious Area for an Urban Indian Catchment,2016,https://dx.doi.org/10.1061/(ASCE)HE.1943-5584.0001346
1081,"Lee, Kyeong-sang|Choi, Sungwon|Seo, Minji|Lee, Chang Suk|Seong, Noh-hun|Han, Kyung-Soo|Neale, CMU|Maltese, A",dtw|snow cover|classification,10.1117/12.2241732,"REMOTE SENSING FOR AGRICULTURE, ECOSYSTEMS, AND HYDROLOGY XVIII",WOS:000393152800060,Snow cover detection algorithm using dynamic time warping method and reflectances of MODIS solar spectrum channels,2016,https://dx.doi.org/10.1117/12.2241732
197,"Dai, C.|Tan, Q.|Lu, W. T.|Liu, Y.|Guo, H. C.",efdc|trophic state index|simulation-optimization|support vector regression|genetic algorithm|water transfer,10.1016/j.ecoleng.2016.06.080,ECOLOGICAL ENGINEERING,WOS:000385371400047,Identification of optimal water transfer schemes for restoration of a eutrophic lake: An integrated simulation-optimization method,2016,https://dx.doi.org/10.1016/j.ecoleng.2016.06.080
11,"Kang, Moon-Seong|Srivastava, Puneet|Song, Jung-Hun|Park, Jihoon|Her, Younggu|Kim, Sang Min|Song, Inhong",comfarm|agricultural water resources|modeling system|object-oriented programming,10.3390/w8080351,WATER,WOS:000387675500016,Development of a Component-Based Modeling Framework for Agricultural Water-Resource Management,2016,https://dx.doi.org/10.3390/w8080351
1086,"Wong, Kum Yeen|Chuah, Joon Huang|Hope, Chris",page09 integrated assessment model|climate change tax|climate policy,10.1080/17583004.2016.1237179,CARBON MANAGEMENT,WOS:000392831500006,Carbon taxation in Malaysia: insights from the enhanced PAGE09 integrated assessment model,2016,https://dx.doi.org/10.1080/17583004.2016.1237179
13,"Vallner, L.|Porman, A.",base flow|estonian hydrosphere|groundwater modelling|hydrological modelling|net infiltration|water budget,10.2166/nh.2016.104,HYDROLOGY RESEARCH,WOS:000381718100011,Groundwater flow and transport model of the Estonian Artesian Basin and its hydrological developments,2016,https://dx.doi.org/10.2166/nh.2016.104
6,"Stewart, G. A.|Baines, J.|Bold, T.|Calafiura, P.|Dotti, A.|Farrel, S. A.|Leggett, C.|Malon, D.|Ritsch, E.|Snyder, S.|Tsulaia, |Van Gemmeren, P.|Wynne, B. M.|Salinas, L|Torres, C",,10.1088/1742-6596/762/1/012024,17TH INTERNATIONAL WORKSHOP ON ADVANCED COMPUTING AND ANALYSIS TECHNIQUES IN PHYSICS RESEARCH (ACAT2016),WOS:000439689600024,Multi-threaded software framework development for the ATLAS experiment,2016,https://dx.doi.org/10.1088/1742-6596/762/1/012024
1461,"Winkel, Thierry|Bommel, Pierre|Chevarria-Lazo, Marco|Cortes, Genevieve|Del Castllo, Carmen|Gasselin, Pierre|Leger, Francois|Nina-Laura, Juan-Peter|Rambal, Serge|Tichit, Muriel|Tourrand, Jean-Francois|Vacher, Jean-Joinville|Vassas-Toral, Anais|Vieira-Pak, Manuela|Joffre, Richard",adaptive cycle|integrated assessment|land use change|rural livelihood strategies|transformative change,10.1016/j.gloenvcha.2016.05.007,GLOBAL ENVIRONMENTAL CHANGE-HUMAN AND POLICY DIMENSIONS,WOS:000381165100019,Panarchy of an indigenous agroecosystem in the globalized market: The quinoa production in the Bolivian Altiplano,2016,https://dx.doi.org/10.1016/j.gloenvcha.2016.05.007
192,"Brunner, Sibyl Hanna|Huber, Robert|Gret-Regamey, Adrienne",backcasting|ecosystem services|normative vision|social-ecological modeling|policy strategies|transition pathways,10.1016/j.envsoft.2015.10.018,ENVIRONMENTAL MODELLING & SOFTWARE,WOS:000367105900033,A backcasting approach for matching regional ecosystem services supply and demand,2016,https://dx.doi.org/10.1016/j.envsoft.2015.10.018
1060,"Sipek, Vaclav|Tesar, Miroslav",hydrological modelling|small catchment|soil moisture|subsurface lateral flow|swim,10.2166/nh.2015.220,HYDROLOGY RESEARCH,WOS:000374314900004,Validation of a mesoscale hydrological model in a small-scale forested catchment,2016,https://dx.doi.org/10.2166/nh.2015.220
1472,"Schmied, Hannes Mueller|Mueller, Richard|Sanchez-Lorenzo, Arturo|Ahrens, Bodo|Wild, Martin",global hydrological modeling|radiation|validation with station observations|bsrn|geba|uncertainty,10.3390/w8100450,WATER,WOS:000389659200035,Evaluation of Radiation Components in a Global Freshwater Model with Station-Based Observations,2016,https://dx.doi.org/10.3390/w8100450
1056,"Gungordu, Abbas|Uckun, Mirac|Yologlu, Ertan",amphibia|glyphosate|methidathion|pesticide mixture|biochemical markers,10.1016/j.chemosphere.2015.10.125,CHEMOSPHERE,WOS:000367774400257,Integrated assessment of biochemical markers in premetamorphic tadpoles of three amphibian species exposed to glyphosate- and methidathion-based pesticides in single and combination forms,2016,https://dx.doi.org/10.1016/j.chemosphere.2015.10.125
1471,"Farhadi, Saber|Nikoo, Mohammad Reza|Rakhshandehroo, Gholam Reza|Akhbari, Masih|Alizadeh, Mohammad Reza",sustainable groundwater management|agent-based modeling|simulation-optimization|nash bargaining model|nsga-ii multi-objective optimization model,10.1016/j.agwat.2016.08.018,AGRICULTURAL WATER MANAGEMENT,WOS:000385322900034,An agent-based-nash modeling framework for sustainable groundwater management: A case study,2016,https://dx.doi.org/10.1016/j.agwat.2016.08.018
1470,"Riechel, Mathias|Matzinger, Andreas|Pawlowsky-Reusing, Erika|Sonnenberg, Hauke|Uldack, Mathias|Heinzmann, Bernd|Caradot, Nicolas|von Seggern, Doerthe|Rouault, Pascale",cso|dissolved oxygen|impact assessment|integrated modelling|mitigation measures|river spree,10.1016/j.watres.2016.08.017,WATER RESEARCH,WOS:000385902000026,Impacts of combined sewer overflows on a large urban river - Understanding the effect of different management strategies,2016,https://dx.doi.org/10.1016/j.watres.2016.08.017
2,"Tian, Fuqiang|Yang, Pengju|Hu, Hongchang|Dai, Chao",plastic mulch|dual crop coefficient|simdualkc model|eddy covariance,10.3390/w8030072,WATER,WOS:000373691200019,Partitioning of Cotton Field Evapotranspiration under Mulched Drip Irrigation Based on a Dual Crop Coefficient Model,2016,https://dx.doi.org/10.3390/w8030072
3,"Heikkurinen, Matti|Kranzlmueller, Dieter",environmental computing|body of knowledge|survey methods,,PROCEEDINGS OF THE 2016 IEEE 12TH INTERNATIONAL CONFERENCE ON E-SCIENCE (E-SCIENCE),WOS:000405564400056,"Environmental computing - applications, tools and data solutions",2016,https://dx.doi.org/
1059,"Chen, Dan|Liu, Zhi|Luo, Zhaohui|Webber, Michael|Chen, Jing",bibliometric analysis|emergy|web of science|citespace,10.1016/j.ecoleng.2016.01.026,ECOLOGICAL ENGINEERING,WOS:000373376700035,Bibliometric and visualized analysis of emergy research,2016,https://dx.doi.org/10.1016/j.ecoleng.2016.01.026
1466,"Vaishnav, Parth|Fischbeck, Paul S.|Morgan, M. Granger|Corbett, James J.",,10.1021/acs.est.5b04860,ENVIRONMENTAL SCIENCE & TECHNOLOGY,WOS:000369471300004,Shore Power for Vessels Calling at US Ports: Benefits and Costs,2016,https://dx.doi.org/10.1021/acs.est.5b04860
1061,"van der Wal, Merel M.|de Kraker, Joop|Kroeze, Carolien|Kirschner, Paul A.|Valkering, Pieter",social learning|serious game|simulation model|water management,10.1016/j.envsoft.2015.10.008,ENVIRONMENTAL MODELLING & SOFTWARE,WOS:000367105900010,Can computer models be used for social learning? A serious game in water management,2016,https://dx.doi.org/10.1016/j.envsoft.2015.10.008
205,"Jose Ibarrola-Rivas, Maria|Nonhebel, Sanderine",nitrogen fertilizer use per person|land use per person|dietary patterns|agricultural production systems|global variations,10.3390/su8121322,SUSTAINABILITY,WOS:000393315100045,"Variations in the Use of Resources for Food: Land, Nitrogen Fertilizer and Food Nexus",2016,https://dx.doi.org/10.3390/su8121322
211,"Maione, Michela|Fowler, David|Monks, Paul S.|Reis, Stefan|Rudich, Yinon|Williams, Martin L.|Fuzzi, Sandro",air quality|climate change|short lived climate pollutants|policy,10.1016/j.envsci.2016.03.011,ENVIRONMENTAL SCIENCE & POLICY,WOS:000382595000007,Air quality and climate change: Designing new win-win policies for Europe,2016,https://dx.doi.org/10.1016/j.envsci.2016.03.011
1063,"Mohan, S.|Ramsundram, N.",reservoir operation|data-mining|ann|svr,10.1007/s11269-016-1351-5,WATER RESOURCES MANAGEMENT,WOS:000379183600001,Predictive Temporal Data-Mining Approach for Evolving Knowledge Based Reservoir Operation Rules,2016,https://dx.doi.org/10.1007/s11269-016-1351-5
1465,"Ravazzani, G.|Curti, D.|Gattinoni, P.|Della Valentina, S.|Fiorucci, A.|Rosso, R.",groundwater contribution|streamflow|alpine river|heat tracer method|integrated distributed hydrological model,10.1002/rra.2921,RIVER RESEARCH AND APPLICATIONS,WOS:000378715500005,Assessing Groundwater Contribution to Streamflow of a Large Alpine River with Heat Tracer Methods and Hydrological Modelling,2016,https://dx.doi.org/10.1002/rra.2921
209,"Riboust, Philippe|Brissette, Francois",,10.1080/07011784.2014.982190,CANADIAN WATER RESOURCES JOURNAL,WOS:000375408100017,Analysis of Lake Champlain/Richelieu River's historical 2011 flood,2016,https://dx.doi.org/10.1080/07011784.2014.982190
1464,"das Gracas Silva, Talita Fernanda|Vincon-Leite, Brigitte|Giani, Alessandra|Figueredo, Cleber Cunha|Petrucci, Guido|Lemaire, Bruno|Von Sperling, Eduardo|Tassin, Bruno|Seidl, Martin|Viet Tran Khac, |Viana, Priscila Siqueira|Lima Viana, Valquria Flavia|Toscano, Rodrigo Argolo|Maia Rodrigues, Brenner Henrique|Nascimento, Nilo de Oliveira",lake modelling|hydrological modelling|urban lakes,10.1590/S1413-41520201600100125692,ENGENHARIA SANITARIA E AMBIENTAL,WOS:000375083200010,Modelling Lake Pampulha: a tool for assessing the catchment area impacts on the phytoplankton dynamics,2016,https://dx.doi.org/10.1590/S1413-41520201600100125692
